start,end,text
1212.0,1214.0,だからこそ両方をちょっと両党していくみたいな
1216.0,1218.0,ここまで注目すべきところは
1218.0,1220.0,youtubeデータ収入について何も語ってないところ
1220.0,1222.0,全部募金すればよくね
1222.0,1224.0,みんな夢見すぎ
1224.0,1226.0,絶対月10万は100%超えないから
1226.0,1228.0,100%超えないから
1228.0,1230.0,甘く見すぎだよお金を
1230.0,1232.0,多分ね20万ぐらいだったら
1232.0,1234.0,全然募金できるから
1234.0,1236.0,俺の心揺れないと思うのね
1236.0,1238.0,超えてきそうだったらやめるわ
1238.0,1240.0,ちょっとみんなやめ
1240.0,1242.0,俺がフルドバギンスになりそう
1242.0,1244.0,っていうアピールするね
1244.0,1246.0,絶対超えないから
1248.0,1250.0,絶対超えないから
1250.0,1252.0,だって1再生で
1252.0,1254.0,0.05でしょ100万再生で
1254.0,1256.0,5万円でしょ無理だよ
1256.0,1258.0,100万再生して5万円だよ
1258.0,1260.0,100万再生すると思う
1260.0,1262.0,俺の動画が
1262.0,1264.0,死なくない?
1266.0,1268.0,しかも稼ぐんだったら
1268.0,1270.0,ニコ動のほうが絶対稼げるから
1270.0,1272.0,単純に収入だけ考えたら
1272.0,1274.0,ニコ動のほうが絶対伸びるじゃん
1274.0,1276.0,YouTubeの俺なんて
1276.0,1278.0,ほんとみそっかすだろスッパマンだぞ
1280.0,1282.0,過信しすぎだよ
1282.0,1284.0,だってここに聞いてる人たちも
1284.0,1286.0,YouTubeに動画あげたら絶対見ないよ
1286.0,1288.0,っていう人いっぱいいるでしょ
1288.0,1290.0,10万はリーマンの俺でも言ってる
1290.0,1292.0,それはさ結構なんかコンスタントやってんじゃないの
1292.0,1294.0,俺3分の動画を
1294.0,1296.0,2ヶ月間続けるだけとかでしょ
1296.0,1298.0,わかんないんだけどねまだね
1298.0,1300.0,1000人が1万回見る
1300.0,1302.0,いいね
1304.0,1306.0,まぁちょっとなんかそれを考えてんだよね
1306.0,1308.0,決定じゃないんだよ決定じゃないよ
1308.0,1310.0,もう話がどんどん進んでるけど
1310.0,1312.0,MSSPでさYouTubeの動画を伸びてない
1312.0,1314.0,そうだよねYouTube用にちゃんと作んないといけないと思うんだよね
1314.0,1316.0,別に見なくてもいい
1316.0,1318.0,見なくてもいいんだよね
1318.0,1320.0,本音を言うんだったら見ないでほしい
1320.0,1322.0,向こうの新規の奴らとちょっと絡んで
1322.0,1324.0,こっちに引っ張っていきたいんだよね
1324.0,1326.0,石川乗り行きシステム
1326.0,1328.0,向こうのちょっと新規の奴らと
1328.0,1330.0,がっつり絡んでこっち連れていきたいんだよね
1330.0,1332.0,って思ってる
1334.0,1336.0,あの理想としては
1336.0,1338.0,分かりやすい笑いの方がいい
1338.0,1340.0,いやでもさ分かんないじゃん上げてみないと分かんないんだよ
1340.0,1342.0,上げてみないと分かんないじゃん
1342.0,1344.0,俺そんなやったことないし
1344.0,1346.0,いやMSSPは2個どうでもそんなもんだろ
1346.0,1348.0,いや結構伸びてるじゃん
1348.0,1350.0,結構伸びてるじゃん
1350.0,1352.0,いやもう
1352.0,1354.0,ヒカキンの本叩くとかそういうのしたくないんだよな
1354.0,1356.0,普通にやりたいこと1個だけあって
1356.0,1358.0,普通にやりたいことが1個だけあるんだよね
1358.0,1360.0,純粋に
1360.0,1362.0,あの向こうですねYouTuberのみたい
1362.0,1364.0,向こうがなんかもう先生みたいな
1364.0,1366.0,向こう先生
1366.0,1368.0,あもう先生じゃん先生か
1370.0,1372.0,いや怒られることじゃない
1372.0,1374.0,怒られることじゃない
1374.0,1376.0,適当に商品買ってレビューすれば稼げるんじゃない
1376.0,1378.0,稼ぐとかじゃなくて1個やりたい企画があるんだよね
1378.0,1380.0,しかも結構なんか
1380.0,1382.0,YouTube系いいんじゃねえかな
1382.0,1384.0,っていう
1384.0,1386.0,感じなんだよね
1386.0,1388.0,顔は絶対出さないけど
1388.0,1390.0,マスクして出るかな
1390.0,1392.0,ドル字マスクだったり顔全部隠して
1394.0,1396.0,レビュー系の動画はもうね
1396.0,1398.0,伸びないっていうかもう
1398.0,1400.0,食商じゃない今更上げるやつとかセンスなさすぎじゃない
1400.0,1402.0,違うよな
1404.0,1406.0,なんかちょっとだから
1406.0,1408.0,あのー
1408.0,1410.0,そういうこと考えてた今
1410.0,1412.0,考えてた
1412.0,1414.0,このままね緩やかに衰退していってもいいんだけど
1414.0,1416.0,ニコニコに
1416.0,1418.0,ニコニコに上げてもいいな
1418.0,1420.0,あそっかそっちもいくかじゃん
1420.0,1422.0,そっちもいくかじゃん
1424.0,1426.0,めっちゃ大変じゃん俺
1426.0,1428.0,ニコ動にも上げる
1428.0,1430.0,3分クッキングとかしょうもないことしねえよ
1430.0,1432.0,だったら俺ニコ生でやりてえ
1432.0,1434.0,チャンネルで
1434.0,1436.0,いやでもね違うやつ上げたいね
1438.0,1440.0,春米れんこしてる俺でもチャンネル入ってるんだぞ
1440.0,1442.0,俺のチャンネルってこと?
1442.0,1444.0,お前だったらもっと有意義に使えよ
1444.0,1446.0,お前のコメント毎回見てるけど
1446.0,1448.0,全部無視してんだよ
1450.0,1452.0,進んで無視してるんだよ
1452.0,1454.0,せっかくお前月500円払って
1454.0,1456.0,俺に無視されてんだよ
1456.0,1458.0,意味なくない?
1458.0,1460.0,かわいそうだろ
1460.0,1462.0,って考えてんだよね
1462.0,1464.0,一回実況動画上げる
1464.0,1466.0,いやでもねみんな違うんだよ
1466.0,1468.0,俺のじゃあ悩み聞いて本気で
1468.0,1470.0,これ本気だからね嘘じゃねえよ
1470.0,1472.0,実況動画上げてもいいの
1472.0,1474.0,でしかもぶっちゃけ何本かやれば
1474.0,1476.0,面白い動画撮れると思うんだよ
1476.0,1478.0,自分の生放送見てるとね
1478.0,1480.0,生放送と実況と全然違うだろうけど
1480.0,1482.0,何本か上げれば
1482.0,1484.0,たださ一本集中だと絶対無理なんだよね
1484.0,1486.0,みんなもうそういうスタイル撮ってないでしょ
1486.0,1488.0,アブさんとかだってさ
1488.0,1490.0,何本か上げて
1490.0,1492.0,なんかそのうちの一本がバーって伸びて
1492.0,1494.0,その動画続けるみたいな感じじゃん
1494.0,1496.0,俺もやるんだったらその感じでやろうと思ってるんだよね
1500.0,1502.0,コンスタントにっていうかさ
1502.0,1504.0,何本か
1504.0,1506.0,いくら面白くてももう伸びない
1506.0,1508.0,いやその考えははっきり言って
1508.0,1510.0,アイドル実況者の囲いと一緒なんだよ
1510.0,1512.0,お前が上げても伸びないっていうのは絶対ないと思う
1512.0,1514.0,俺の動画が伸びると思うから
1514.0,1516.0,だって面白いんだよ
1516.0,1518.0,俺の動画が伸びなかったら
1518.0,1520.0,俺の動画が面白くないんだよ
1520.0,1522.0,俺が上げても伸びないんじゃなくて
1522.0,1524.0,俺の撮った動画が面白くないだけじゃない
1524.0,1526.0,だから面白い動画は伸びるって絶対
1526.0,1528.0,いるんだから視聴者は
1528.0,1530.0,いや単発で様子見とかしたくねーな
1530.0,1532.0,じゃない?
1532.0,1534.0,いや夢見すぎじゃないって
1534.0,1536.0,だってその
1536.0,1538.0,前例が多分さ
1538.0,1540.0,昔伸びてたやつの動画って
1540.0,1542.0,一生懸命じゃないんだよ
1542.0,1544.0,みんなさ有名どころがさ
1544.0,1546.0,例えばイボーンとか上げんじゃん
1546.0,1548.0,一生懸命さが全然ないじゃん
1548.0,1550.0,あんなの伸びないよ絶対
1550.0,1552.0,ブームが起きるの待ってるみたいな
1552.0,1554.0,なんかやっぱさ怖いんだよ俺もそうだけど
1554.0,1556.0,なんかさ挑戦するの怖くない?
1556.0,1558.0,なんかちょっとさ演出入れるのとか
1558.0,1560.0,めっちゃ怖いの怖くない?
1560.0,1562.0,今さら
1562.0,1564.0,怖いじゃん
1564.0,1566.0,だからちょっと
1566.0,1568.0,知名度ゼロだからいいんじゃんニコ動で
1568.0,1570.0,知名度ゼロだからちょっと上げたくない?
1570.0,1572.0,滑ったらきついよねでも滑ってもいいや
1572.0,1574.0,って思う覚悟で上げないと
1574.0,1576.0,って思ってます
1576.0,1578.0,わかるよねその気持ち
1580.0,1582.0,毎日毎日動画上げるわけじゃないから
1582.0,1584.0,溜めて撮ってある程度形にして
1586.0,1588.0,でニコ生も週1やるみたいな
1590.0,1592.0,いやでも編集していかなきゃ絶対伸びないと思うんだよね
1592.0,1594.0,なんか演出とかはできないけど
1594.0,1596.0,ある程度カットとかはしていかないと
1596.0,1598.0,もうねみんなやっぱね
1598.0,1600.0,そういう楽しさ求めてないでしょ
1600.0,1602.0,見やすさとかさ
1604.0,1606.0,このまま生放送だけでいいや
1606.0,1608.0,そういう人は待っててここでちょっと
1608.0,1610.0,なんか俺がやっててもっと人いた方が面白いな
1610.0,1612.0,っていうのが単純にあって
1612.0,1614.0,単純に人いた方が面白いじゃん
1614.0,1616.0,生放送って面白くない?
1616.0,1618.0,俺だけ?
1618.0,1620.0,視聴者多い方絶対面白いから
1620.0,1622.0,なんかねチャンネル満員にするぐらいさ
1622.0,1624.0,集めたいなっていうのが本能だ
1624.0,1626.0,本意としてあるんだよね
1626.0,1628.0,暗黒放送面白くなさそうだけど
1628.0,1630.0,やってても
1630.0,1632.0,あの仕事感が
1632.0,1634.0,暗黒放送は面白くなさそうです
1634.0,1636.0,俺は見てて
1636.0,1638.0,疲れてると思う
1638.0,1640.0,疲れてると思う
1640.0,1642.0,仕事感めっちゃ出てるじゃん
1642.0,1644.0,だよね
1646.0,1648.0,十分いるだろ
1648.0,1650.0,分かってるんだけどさ
1650.0,1652.0,やっぱり人間っていうのは
1652.0,1654.0,慣れてきてしまうもので
1656.0,1658.0,慣れてきてしまうもので
1658.0,1660.0,視聴者これ以上人が増えること
1660.0,1662.0,望んでないと思う
1662.0,1664.0,お前3000人ぐらい見に来てんだろ
1664.0,1666.0,だいたい
1666.0,1668.0,だったら別に5000人6000人来ても変わんねえだろうが
1668.0,1670.0,視聴者的には
1670.0,1672.0,俺だけだろうが変わるのは
1674.0,1676.0,じゃない?
1676.0,1678.0,もっとやっぱ人集めたいんだよね
1678.0,1680.0,単純に
1682.0,1684.0,セキトルの面倒
1684.0,1686.0,なるほどな
1686.0,1688.0,一瞬で前にならねえだろ
1688.0,1690.0,プレイヤーになればよくない?
1690.0,1692.0,ニコ動
1692.0,1694.0,そうだそうだ
1694.0,1696.0,保守的になりすぎててさ
1696.0,1698.0,本当にさ
1698.0,1700.0,俺がニコ生で一番保守的じゃん
1700.0,1702.0,何にもしてなくない?
1702.0,1704.0,俺この5年間さ
1704.0,1706.0,誰とコラボしたわけでもないしさ
1706.0,1708.0,俺何してたんだろうってなっちゃって
1708.0,1710.0,だからこそ
1710.0,1712.0,今があるのかもしれないけど
1712.0,1714.0,もうちょっとやっぱやりたいんだよね
1714.0,1716.0,本音として
1716.0,1718.0,もうちょっとやるんだよね
1718.0,1720.0,やりたいんだよね
1720.0,1722.0,もうちょっと
1722.0,1724.0,モコーとマリカしたぐらいだよ新しいことしたのって
1726.0,1728.0,やってみたいんだよね
1730.0,1732.0,5年間キスを固め続けてた
1732.0,1734.0,俺はドリブルだけし続けてきた
1734.0,1736.0,延長してなかったか
1738.0,1740.0,延長できませんになってる
1740.0,1742.0,くそすぎるまじ本当YouTube最高だわ
1742.0,1744.0,だからこういうことになるんだよな
1744.0,1746.0,本当に
1746.0,1748.0,爪が甘えっていうか
1748.0,1750.0,本当にこういうことなんだよな
1750.0,1752.0,ドワンゴの爪の甘さ
1754.0,1756.0,コメの方で言ったらそうだな
1756.0,1758.0,コメでやります
1758.0,1760.0,本音で語れないんで
1760.0,1762.0,本当にニワンゴ最高
1762.0,1764.0,ドワンゴ最高
1766.0,1768.0,ドワンゴ最高
