start,end,text
1240.0,1242.0,デイトレーダーとかは
1242.0,1244.0,確かに
1244.0,1246.0,いるのかもしれないね
1246.0,1248.0,だってさ
1248.0,1250.0,1年やっちまえば仕事の中慣れるしさ
1250.0,1252.0,でバカみたいにさ
1252.0,1254.0,口広げてさ
1254.0,1256.0,ヘコヘコしてたら月20万ぐらいもらえるんだよ
1256.0,1258.0,で休み10日ぐらいあるんだよ
1258.0,1260.0,絶対そのほうが楽だから
1262.0,1264.0,絶対楽だよ
1264.0,1266.0,しかも仕事なんか選ばないと腐るほうがあるだろうし
1266.0,1268.0,10日もねえか
1268.0,1270.0,何日休暇あるのみんな
1270.0,1272.0,8日ぐらい
1272.0,1274.0,8日間はあるの
1274.0,1276.0,俺もねえけど
1276.0,1278.0,ベースが10日だな
1278.0,1280.0,いや9日だな
1280.0,1282.0,6はきついねえ
1282.0,1284.0,6めっちゃきついねえ
1284.0,1286.0,6めっちゃきついねえ
1286.0,1288.0,6きついなあ
1288.0,1290.0,6きちいな
1290.0,1292.0,6きちいな
1292.0,1294.0,6きちいな
1294.0,1296.0,今の職場かなりホワイトだよ
1296.0,1298.0,今の職場かなりホワイトだよ
1298.0,1300.0,残業全くないし
1300.0,1302.0,有給も全部使えるし
1302.0,1304.0,希望給通り放題だし
1304.0,1306.0,すげえホワイトカラーなんだけど
1306.0,1308.0,給料めっちゃいいし
1308.0,1310.0,給料めちゃくちゃいいし
1310.0,1312.0,4とか地獄やなほんと
1312.0,1314.0,ある程度
1314.0,1316.0,適当に休んだほうがいいよ
1316.0,1318.0,仕事が大事だ大事だって言ってるけど
1318.0,1320.0,命が一番大事だからね
1320.0,1322.0,自営業とかね
1322.0,1324.0,給料結構いいよ
1324.0,1326.0,俺500は全然もらってるから
1326.0,1328.0,夜勤なくて
1328.0,1330.0,俺の年間500って相当もらってるほうだと思うな
1330.0,1332.0,500
1334.0,1336.0,結構余裕あるよだから
1336.0,1338.0,結構余裕あるよだから
1338.0,1340.0,プラスアルファで不労所得みたいなのもあるから
1340.0,1342.0,今さ
1342.0,1344.0,社会のさ
1344.0,1346.0,平均ってどんぐらいなの
1346.0,1348.0,社会の平均
1348.0,1350.0,単純な病院のお給料だとちょうど500万
1350.0,1352.0,ちょうど500万
1352.0,1354.0,ちょうど500
1354.0,1356.0,300万
1356.0,1358.0,夢がなさすぎるなあ
1358.0,1360.0,待ってねえ350万ってさ
1360.0,1362.0,手取りいくらなの
1362.0,1364.0,ねえねえねえ
1364.0,1366.0,350って手取りいくらなの
1366.0,1368.0,手取りいくらなの
1370.0,1372.0,手取りいくら
1372.0,1374.0,20
1374.0,1376.0,マジで
1376.0,1378.0,つらくねえ
1380.0,1382.0,手取り20ってマジつらくない
1382.0,1384.0,つらくない
1386.0,1388.0,やばいなそれなあ
1390.0,1392.0,手取り20ってやばいなあ
1392.0,1394.0,手取り15とかなんだけど
1394.0,1396.0,どうやって暮らしてんの
1396.0,1398.0,煽ってるわけじゃなくて
1398.0,1400.0,結構ボロめのマンション住んで
1400.0,1402.0,食べたいもん我慢せずにみたいな感じ
1402.0,1404.0,まあ田舎はなあ
1404.0,1406.0,看護師とかなんないわ別に
1406.0,1408.0,アホでもできんだろとか言ったら怒られるだろうけど
1408.0,1410.0,アホでもできそうじゃない
1410.0,1412.0,で600万くらいもらってるね
1412.0,1414.0,700万くらいもらってるよ夜勤してるやつらとか
1416.0,1418.0,やれやれいいのに
1420.0,1422.0,もう学校入れないわそうなんだ
1424.0,1426.0,大学病院とかだったらさ
1426.0,1428.0,そんくらいもらえてんじゃないの
1428.0,1430.0,地方なんかそんなのザラだぞ
1430.0,1432.0,そういうもんなんだなあ
1432.0,1434.0,マジで看護師アホでもできる
1434.0,1436.0,そういうもんなんだな
1436.0,1438.0,12×20
1438.0,1440.0,320
1440.0,1442.0,マジか
1442.0,1444.0,やべえなほんとな
1444.0,1446.0,まあ確かに東京基準で
1446.0,1448.0,でも東京はその分家賃も高いし
1448.0,1450.0,駐車台込みで俺も月20払ってるんだよ
1450.0,1452.0,馬鹿らしくね
1452.0,1454.0,引っ越さなきゃだめだよな
1454.0,1456.0,引っ越さなきゃ
1456.0,1458.0,日以来は手取り17万だわ
1458.0,1460.0,でもその分なんか福利構成ってやつじゃないの
1460.0,1462.0,なんか旧
1462.0,1464.0,家賃タダとかさ
1464.0,1466.0,家賃タダとかそういう
1466.0,1468.0,夢出してるあ夢があるね
1468.0,1470.0,お前の歳によるな30だったらぼちぼちやめて
1470.0,1472.0,やめたほうがいいんじゃないのって思っちゃうけど
1474.0,1476.0,30だったらぼちぼちなんか
1476.0,1478.0,ねえ地に足つけて
1478.0,1480.0,生きなきゃいけないんじゃないのかなと
1480.0,1482.0,思っちゃうけどね
1482.0,1484.0,お前のやつが俺の給料より高いぞ
1486.0,1488.0,別にバカにするわけじゃないけど
1488.0,1490.0,なんでさお給料のいい仕事に
1490.0,1492.0,つかないのみんなは
1492.0,1494.0,だって仕事なんか何やってても苦しいのにさ
1494.0,1496.0,なんでわざわざさ
1496.0,1498.0,苦しくて給料の少ない
1498.0,1500.0,仕事やってんのほんとに
1500.0,1502.0,やめたほうがいい
1502.0,1504.0,つけなくない絶対つけるから
1504.0,1506.0,いや看護師やればいいじゃん
1506.0,1508.0,看護師やれば
1508.0,1510.0,いいじゃねえかよ
1510.0,1512.0,学なんてなくてもできんだろ絶対
1512.0,1514.0,専門とかいけばいいじゃん
1516.0,1518.0,やればいいじゃん
1518.0,1520.0,専門学校とかいけばいいじゃん
1520.0,1522.0,専門学校とか
1523.0,1525.0,専門に行く金がない
1525.0,1527.0,そこはさ
1527.0,1529.0,奨学金とか借りて
1529.0,1531.0,奨学金借りればいいじゃん
1531.0,1533.0,血とか苦手
1533.0,1535.0,あーまあな
1535.0,1537.0,頭なんて別に俺も良くねえよ別に対して
1537.0,1539.0,平均だよ平均
1539.0,1541.0,たぶん
1541.0,1543.0,2位と高みのゲーム
1543.0,1545.0,むずい
1545.0,1547.0,だからなんか世の中はそういうさ
1547.0,1549.0,あれにあふれてんだろうな
1549.0,1551.0,人の不幸を
1552.0,1554.0,喜ぶこのニコ生が栄える
1554.0,1556.0,きっかけになってんだろうな
1556.0,1558.0,まあ奨学金は借りない方がいいと思うけど
1558.0,1560.0,俺も
1560.0,1562.0,幸いさうちはさ
1562.0,1564.0,みぜに来てさ奨学金借りずに
1564.0,1566.0,学校出してもらったから
1566.0,1568.0,その点考えると親に本当に感謝だね
1568.0,1570.0,本当に感謝だね
1570.0,1572.0,本当に感謝
1572.0,1574.0,マジで
1574.0,1576.0,お母さんに頭上がんねえよ
1576.0,1578.0,突然話ぶっこんで今度うちのお姉ちゃんがまた結婚するんだけど
1578.0,1580.0,いくら進めばいいの
1581.0,1583.0,あの人
1583.0,1585.0,俺お姉ちゃん大好きだからさやっぱり
1585.0,1587.0,ねえ
1587.0,1589.0,お姉ちゃんの結婚式は盛大に祝いたいじゃん
1589.0,1591.0,なんであのクズって
1591.0,1593.0,おめえうちの母ちゃん見てんだぞ
1593.0,1595.0,この方さ
1595.0,1597.0,今度はね
1597.0,1599.0,手堅い王子様とくっついたよ
1599.0,1601.0,俺より1個下の顔がかっこいい
1603.0,1605.0,王子様と
1605.0,1607.0,でもまだ俺相手に1回も会ったことないっていうさ
1607.0,1609.0,相手に1回も
1610.0,1612.0,20万くらい積んでやるか
1612.0,1614.0,しょうがねえから
1614.0,1616.0,おめでたいな
1616.0,1618.0,血を分けた兄弟の
1618.0,1620.0,あのバカまた結婚か
1620.0,1622.0,本当聞かせてやりたいよ
1622.0,1624.0,この世論を
1624.0,1626.0,あのバカまた結婚するのか
1626.0,1628.0,なんでさ
1628.0,1630.0,簡単に結婚するんだろうね
1630.0,1632.0,しなきゃいいのにもう
1632.0,1634.0,不適合者なんだから
1634.0,1636.0,しなきゃいいのにさ
1639.0,1641.0,いやうちの姉ちゃんはね
1641.0,1643.0,メンヘラとはね本当に程遠い
1643.0,1645.0,あいつはマジで
1645.0,1647.0,世界で2番目にメンタル強いよ
1647.0,1649.0,何言っても同時代からね彼女は
1649.0,1651.0,あれはやばいよ
1651.0,1653.0,みんなの煽りとか聞かねえから
1653.0,1655.0,マジで
1655.0,1657.0,メンタル強い1番うちの母ちゃん
1659.0,1661.0,この前なんか会社の
1661.0,1663.0,揉め事に巻き込まれて4回くらい
1663.0,1665.0,裁判所呼ばれてたけど全然同時代なかったから
1665.0,1667.0,まあ働いてればねそういうことあるんですよ
1667.0,1669.0,4回くらい裁判所呼ばれてたから
1669.0,1671.0,なんかその
1673.0,1675.0,まあしかもまあ最悪
1675.0,1677.0,クビになったとしても別にいいんだって言いながら
1677.0,1679.0,気も座ってんだろ
1679.0,1681.0,うちの家族
1685.0,1687.0,男が弱いんだよね
1687.0,1689.0,うちのお父さんは
1689.0,1691.0,まあ
1691.0,1693.0,メンタル弱くてさ
1693.0,1695.0,ずーっと子どちゃ見てるよ子どちゃ
1695.0,1697.0,子どものおもちゃをずーっと見てた
1697.0,1699.0,好きだから
1699.0,1701.0,猫と
1701.0,1703.0,15匹くらい猫が
1703.0,1705.0,ってて今うち
1705.0,1707.0,やばくない?うちのお父さん頭おかしくなっちゃって
1707.0,1709.0,なんかあのさ
1709.0,1711.0,よくさ
1711.0,1713.0,ゴミ屋敷に住んでるクソジジイとかがさ
1713.0,1715.0,犬とか猫を頼りに生きてくじゃん
1715.0,1717.0,うちのお父さん本当に頭おかしくなっちゃって
1717.0,1719.0,16号みたいな感じで
1719.0,1721.0,どんどん猫がうちのお父さんの周りに
1721.0,1723.0,集まってきて
1723.0,1725.0,猫屋敷になっちゃってさ
1725.0,1727.0,ほんと16号だよ
1727.0,1729.0,なんか道を歩いてる猫が
1729.0,1731.0,うちのお父さんに吸い寄せられるみたいな感じで
1731.0,1733.0,ほんとに
1733.0,1735.0,そこいらじゅうにいる野良猫がさ
1735.0,1737.0,別に飼ってるわけじゃねーよ
1737.0,1739.0,こいつらが勝手に寄ってくるんだおーって言ってた
1739.0,1741.0,この前
1743.0,1745.0,うちのおばあちゃんが殺そうとしてたけど
1745.0,1747.0,なんかあの
1747.0,1749.0,あのー
1749.0,1751.0,害虫駆除の団子みたいなので
1751.0,1753.0,お父さんダメだから殺すしかねーよって
1755.0,1757.0,俺はばあちゃん派だな
1757.0,1759.0,なんかその
1759.0,1761.0,害虫駆除の団子を食わせようとしてたけど
1761.0,1763.0,それで揉めてたうちのお父さんと
1763.0,1765.0,うちのババアが
1765.0,1767.0,おばあちゃんまた入院しちゃってさ
1767.0,1769.0,足の骨折って
1769.0,1771.0,足の骨折って手術して1週間で帰ってきたからまた
1771.0,1773.0,あの震災の日に
1773.0,1775.0,膝から崩れ落ちて
1775.0,1777.0,右膝を複雑骨折して
1777.0,1779.0,2週間で帰ってきて
1779.0,1781.0,40歳くらいの骨折してたらしい
1781.0,1783.0,ボルトが止まる止まるって言ってた先生が
1783.0,1785.0,でなんかこの前もさ
1785.0,1787.0,転んでさ
1787.0,1789.0,あのー
1789.0,1791.0,大腿骨軽部骨折したんだけど1週間で退治してたから
1791.0,1793.0,病院はやだ!
1793.0,1795.0,まぁでもあれだな
1795.0,1797.0,90になるからさ
1797.0,1799.0,まぁあんまり言いたくないけど
1799.0,1801.0,もうすぐ死ぬじゃんうちのおばあちゃんも
1801.0,1803.0,みんなのおばあちゃん
