start,end,text
1038.0,1040.0,タケノコって誰だっけ、つーか
1040.0,1042.0,タケノコって誰だっけ、分かりません
1042.0,1044.0,名前一つでよかったと、だからさ
1044.0,1046.0,なんかさ、そういうさ、なんつーの
1046.0,1048.0,俺にさ、なんつーの
1048.0,1050.0,いい思いさせてくれってさ、いいじゃないですか
1050.0,1052.0,全然、なんにも
1052.0,1054.0,俺に声かかんねえな、ほんとに
1054.0,1056.0,どんだけ俺はさ、はぶられてんだよと
1056.0,1058.0,なんかね、ほんとにね、私もやっぱ
1058.0,1060.0,日々精進をしていかなきゃいけないのかなと
1060.0,1062.0,もう諦めないの、確かにね、そういうコメントも
1062.0,1064.0,あるんですけど、リスクを取らずに
1064.0,1066.0,有名になりたい、そうなんだよ、だから
1066.0,1068.0,おめえらの中で有名なやつがいたら、なんかさ、すげえ
1068.0,1070.0,おいしい企画を俺に持ってこいって、なんかさ
1070.0,1072.0,俺すげえ腹立てて、なんかさ、なんつーの
1072.0,1074.0,こんなに頑張ってさ、コミニンズ見てください
1074.0,1076.0,2万人ですよ!コミニンズ2万人なのに
1076.0,1078.0,こんなにね、平日と昼間っから
1078.0,1080.0,汗だらだらかけながらね、
1080.0,1082.0,頑張ってね、放送してるんですよ、私は
1082.0,1084.0,ちょっとね、なんつーのかな
1084.0,1086.0,もうちょっとさ、楽をさせてくれてもいいんじゃないのかなと
1086.0,1088.0,思うんですよね、ほんとに
1088.0,1090.0,君そんなに知名度ないよ
1090.0,1092.0,そう言って言われちまったらね、確かにその通りなんですけど
1092.0,1094.0,なまけっと
1094.0,1096.0,とか出てもさ、自分が頑張ってさ
1096.0,1098.0,リスク、なんかリスクはでかくてリターン少ないじゃないですか
1098.0,1100.0,ほんとに、ねえ、なんかさ
1100.0,1102.0,そんなさ、こいつ
1102.0,1104.0,こいつうるせえだけでほんとに
1104.0,1106.0,なんつーの、尺に触るなみたいなさ
1106.0,1108.0,そういうコメントが流れたらおじまいじゃないですか
1108.0,1110.0,私なんかもっと叩かれないように
1110.0,1112.0,これからね、放送していきたいんですよ
1112.0,1114.0,すぐさ、なんつーの
1114.0,1116.0,おめえら、うなちゃんまんとかにもさ、悪口言われた
1116.0,1118.0,俺なんでだこんな
1118.0,1120.0,別に嫌いじゃない、むしろさ、好感持ってんのにさ
1120.0,1122.0,あいつ病気だろって言われたんですよ、ほんとに
1122.0,1124.0,好きな名前のうちに、あいつ病気だろって言われた人の
1124.0,1126.0,気持ち考えたことあるんですか、あなたたち
1126.0,1128.0,石川のりゆきの放送見てたらね
1128.0,1130.0,韓国人だろって言われたんですよ、ほんとに
1130.0,1132.0,私、ねえ、バリバリの日本人
1132.0,1134.0,こんなにね、あのー、大和小野子
1134.0,1136.0,こんな大和小野子いないのに
1136.0,1138.0,ニコ生に、こんなにね
1138.0,1140.0,日本男子いないのに、あいつ
1140.0,1142.0,韓国人だろって言われたんですよ
1142.0,1144.0,すぐ爆破するうち、うっちゃなんちゃの
1144.0,1146.0,ナンバーに出るんだろ、あいつ韓国人だろって言われたんですよ
1146.0,1148.0,私別に韓国人
1148.0,1150.0,韓国人を嫌いってわけじゃないですけど
1150.0,1152.0,やっぱりねえ、なんていうのかそういうねえ
1152.0,1154.0,ねえ
1154.0,1156.0,いやでも、いや、韓国人じゃないです
1156.0,1158.0,韓国人じゃないんで、ちょっとねえ
1158.0,1160.0,そういう、なんていうのかな
1160.0,1162.0,疑惑はちょっとねえ、晴らしていこうかなと
1162.0,1164.0,思ってます、ほんとに
1164.0,1166.0,てか放送見すぎだろ、でもそれ
1166.0,1168.0,5月くらいだよ、俺辞める前だよ
1168.0,1170.0,確かに辞める前、辞める前に
1170.0,1172.0,その放送見まして、もうチンにね
1172.0,1174.0,ものすごいストレートくらいまして、あ、もうやめてやると
1174.0,1176.0,こんな世界で俺はもう生きていけねえよと
1176.0,1178.0,俺はもうなんていうのか、そのー、ねえ
1178.0,1180.0,あのー、エロ本の裏見て
1180.0,1182.0,にさあ、札束風呂でさあ
1182.0,1184.0,女を両手に抱えて、俺生きていくんだと
1184.0,1186.0,そういう決心で辞めたんですけど
1186.0,1188.0,まあちょっとねえ、水地何してる?ほんとにわかんない
1188.0,1190.0,ほんとにわかんない、水地が
1190.0,1192.0,水地がねえ、こうやって
1192.0,1194.0,ファビオルから在日臭い、私ファビオってませんよ
1194.0,1196.0,今ねえ、その精神状態は
1196.0,1198.0,かなり保たれてます、あ、久々に生放送
1198.0,1200.0,面白いなと、かなりねえ
1200.0,1202.0,充実した、えー
1202.0,1204.0,今、人生送ってますよ、なので皆さんもねえ
1204.0,1206.0,そんな怒んないでください、ねえ
1206.0,1208.0,水地終わったの?ほんとに、終わっちゃったんだ
1208.0,1210.0,まあちょっとねえ、悲しいですけど
1210.0,1212.0,まあねえ、これからまだ若いですから彼も
1212.0,1214.0,彼も若いんでねえ
1214.0,1216.0,ほんとだよ、なんかさあ、あいつさあ
1216.0,1218.0,なんつーの、放送やめますとかも
1218.0,1220.0,言ってねえのにさあ、なんつーの
1220.0,1222.0,放送やめますって言ったら、俺の方が先に復活しちゃって
1222.0,1224.0,この空気、どうしてくれるんですか、ほんとに
1224.0,1226.0,なので皆さんもねえ
1226.0,1228.0,水地さん、なんとかうまく
1228.0,1230.0,俺の好感度下がるじゃん、そういうこと言うと
1230.0,1232.0,なんとかして、おめえらが
1232.0,1234.0,うまいこと言えばいいんだよ、なんかそれで
1234.0,1236.0,署名活動した、みたいな感じにしとけば
1236.0,1238.0,バレずにねえ、たいして俺のこと見てない奴は
1238.0,1240.0,なんかその興味もないですから
1240.0,1242.0,どうしてなんか復活したの、みたいなさあ
1242.0,1244.0,寒いじゃないですか、なんかうまくなんか署名活動した
1244.0,1246.0,結果が、なんか身を結んだな
1246.0,1248.0,みたいな感じでねえ、していただければなと
1248.0,1250.0,思いますよ、ほんとに、なんの話?
1250.0,1252.0,水地さんの話でした
1252.0,1254.0,ちょっとねえ、そのー、なんていうのかな
1254.0,1256.0,突然だったんですけど
1256.0,1258.0,まあでもあれなんだよね、そのー、なりげにそう
1258.0,1260.0,ほんと久々に、2ヶ月ぶりくらいなのか
1260.0,1262.0,ほんとに、5月の15日くらいに
1262.0,1264.0,あのー、ねえ、涙涙の
1264.0,1266.0,あのお別れ、あの時はさあ
1266.0,1268.0,ねえ、みんなデレデレしちゃってたのにさあ
1268.0,1270.0,始まるや否や、俺の足元見えなかったのと
1270.0,1272.0,俺がいない間にねえ
1272.0,1274.0,にちゃん、刑事番、散々ねえ
1274.0,1276.0,俺の悪口ねえ、言ってくれたんですけど
1276.0,1278.0,まあちょっとねえ、そういう悪口にも負けずにねえ
1278.0,1280.0,えー、頑張っていこうかなと
1280.0,1282.0,思います、なんで今日復活したの
1282.0,1284.0,ほんとにだって、だからそういうこと言われても
1284.0,1286.0,わかんないんですよ、ほんとに
1286.0,1288.0,ほんとにわかんない、だから
1288.0,1290.0,説明しますと、8月のねえ
1290.0,1292.0,そのシフトがものすごいことになってまして
1292.0,1294.0,もう過労、過労によりねえ
1294.0,1296.0,これ精神状態を保てないんじゃないのかなと
1296.0,1298.0,ほんと突然、ほんとに突然だよ
1298.0,1300.0,朝起きて、ほんとに突然
1300.0,1302.0,朝起きて、あ、もうだめだと
1302.0,1304.0,生嘘やろ、あ、もう生嘘やろ
1304.0,1306.0,みたいな感じで、もうねえ
1306.0,1308.0,朝の11時から俺オナリー4回してるんだけど
1308.0,1310.0,今日からねえ、今日ねえ、なんとかして回避したかった
1310.0,1312.0,なんとかして俺もこの最悪の事態を回避したかったんだよ
1312.0,1314.0,絶対遅すぎて
1314.0,1316.0,俺はもう絶対あの世界には戻らないつって
1316.0,1318.0,ずーっとねえ、なんとかしてオナリーでごまかしてねえ
1318.0,1320.0,アサミユーマーねえ、最近ねえ
1320.0,1322.0,あのハンダアササー、今ねえ、涙涙ねえ
1322.0,1324.0,反対してしまったハンダアササーだったんだよね
1324.0,1326.0,なんつーの
1326.0,1328.0,頭がちょっと
1328.0,1330.0,おかしくなったお姉ちゃんみたいなシリーズで
1330.0,1332.0,ものすごい勢いでオナリーしてたんですけど朝から
1332.0,1334.0,もうどうしてもねえ、なんつーの
1334.0,1336.0,この精神の自我同一性を保てなかった
1336.0,1338.0,俺は
1338.0,1340.0,自分に正直になれよ
1340.0,1342.0,自分に正直になった結果、別に迷ってるんだったらやればいいじゃんと
1342.0,1344.0,迷ってるんだったらやればいいじゃんみたいな感じで
1344.0,1346.0,やり始めました
1346.0,1348.0,なのでねえ、いろいろ考えたんですよ
1348.0,1350.0,買い物しに行こうかなとかさ
1350.0,1352.0,いろいろ考えたんですけど
1352.0,1354.0,タバコ吸わせてください
1358.0,1360.0,だからねえ、ほんとにねえ
1360.0,1362.0,多少の後悔もあるんですけど
1362.0,1364.0,やっぱりもうねえ、やってしまったものはしょうがないと
1364.0,1366.0,やってしまったものはほんとにねえ
1366.0,1368.0,しょうがないと
1368.0,1370.0,いう気持ちでねえ、やっていこうかなと
1370.0,1372.0,パワプロ買いましたよ、ほんとにパワプロ買いましたよ
1372.0,1374.0,でねえ、パワプロ買って
1374.0,1376.0,なんつーの、パワプロのさあ
1376.0,1378.0,放送してる人いるじゃないですか、いっぱい
1378.0,1380.0,放送してる人のコミュニティに入って
1380.0,1382.0,ものすごい勢いで今荒らしてます、ほんとに
1382.0,1384.0,そいつがねえ、ほんとにムカついて
1384.0,1386.0,そいつがねえ、なんつーの、上から目線でさあ
1386.0,1388.0,口も悪くて、ほんとにムカついたから
1388.0,1390.0,めちゃくちゃに今荒らしてます
1390.0,1392.0,タグチとそこの放送荒らすことが
1392.0,1394.0,俺のねえ、休み期間の
1394.0,1396.0,俺の生きがいでした、ほんとにねえ
1396.0,1398.0,そこの二つの放送がねえ、あのニコニココメント
1398.0,1400.0,アラート使ってもう
1400.0,1402.0,始まれやいない入ってもうねえ
1402.0,1404.0,死ね弾幕、始まれやいない始まってねえ
1404.0,1406.0,もうそこの死ね弾幕を作ることが
1406.0,1408.0,俺のねえ、唯一のねえ、ここの平
1408.0,1410.0,なんつーの、あれを保ってる
1410.0,1412.0,心のねえ、なんつーのかなあ
1412.0,1414.0,その俺の気持ちを抑えつける
1414.0,1416.0,唯一の
1416.0,1418.0,なんつーのかなあ、その楽しみだったんですよ
1418.0,1420.0,ただねえ、ちょっとやっぱそういうやっぱ叩かれる側に
1420.0,1422.0,ちょっと回ってねえ、あの一から
1422.0,1424.0,滝岩といたしまして、一からねえ
1424.0,1426.0,またちょっと鍛えていこうかなと
1426.0,1428.0,一からニコ生して、ほんと見てない
1428.0,1430.0,俺ねえ、二三個しか見てなかったんだよ、ほんとに
1430.0,1432.0,絶対NGされてるだろ
1432.0,1434.0,はい、されました、二枠目でねえ
1434.0,1436.0,ちょっとねえ、みなさんも
1436.0,1438.0,私自身がねえ、そういうこと
1438.0,1440.0,してしまったので
1440.0,1442.0,そういうねえ、コメント
1442.0,1444.0,ちゃんとねえ、私自身も受け止めて
1444.0,1446.0,いこうかなと、思いますので
1446.0,1448.0,厳しいコメントも
1448.0,1450.0,待ってますので、ちょっと
1450.0,1452.0,エアコンつけさせてください
1464.0,1466.0,はい
1470.0,1472.0,まあ、節電節電って言ってますけど
1472.0,1474.0,ちょっとねえ、その
1474.0,1476.0,いろいろ節電とか、やっぱねえ
1476.0,1478.0,節電もしなきゃいけないなと思ってるんですけど
1478.0,1480.0,まあちょっとねえ
1480.0,1482.0,まあ
1482.0,1484.0,エアコンぐらいはちょっとねえ、我慢していただければなと
1484.0,1486.0,思います
1486.0,1488.0,いや、やってらんないとか何か別にさ
1488.0,1490.0,職場とかでもさあ、結構節電モードじゃない
1490.0,1492.0,ほんとに、いやちょっとさあ、なんか
1492.0,1494.0,もうちょっとさあ、なんつーの?この
1494.0,1496.0,ねえ、再会をさあ、お前らさあ、なんつーの?
1496.0,1498.0,え、うんこちゃん、この2ヶ月間
1498.0,1500.0,何やってたの?みたいな話にならないですか?
1500.0,1502.0,みなさんはどういう放送を見てたんですか?どうせなんかしょうもない
1502.0,1504.0,さあ、放送見てたんでしょ?ほんとに
1504.0,1506.0,しょうもない放送見てたんでしょ?
1506.0,1508.0,だからちょっとねえ、シャーク元気
1508.0,1510.0,ちょっとねえ、夫の浮気によりちょっと
1510.0,1512.0,今ねえ、危ぶまれてるんですけど
1512.0,1514.0,そこはやっぱねえ、私、男うんこちゃんが仲を
1514.0,1516.0,とりもじまして、まあちょっとまあ待てよと
1516.0,1518.0,まあ待てよと
1518.0,1520.0,まだ早いよと、ほんとだよ俺ねえ
1520.0,1522.0,その彼女、彼女じゃない、そのねえ、そのお姉ちゃんが
1522.0,1524.0,新婚旅行をねえ、イタリアに行くんですよ
1524.0,1526.0,イタリアに行くって言うからさあ、やっぱりさあ
1526.0,1528.0,なんつーの?その結婚式ねえ
1528.0,1530.0,その家族で包んだんですよ
1530.0,1532.0,私自身、なんか個人的に包まなかったから
1532.0,1534.0,ちょっとねえ、なんつーの?色付けてやろう
1534.0,1536.0,みたいな感じで、10万円、すごいでしょ?
1536.0,1538.0,10万円包んで、お姉ちゃんに渡した
1538.0,1540.0,これでね、好きなもん食ってこようと
1540.0,1542.0,そしたらさあ、その次の日に
1542.0,1544.0,夫のねえ、あの、結婚する前の浮気が
1544.0,1546.0,判明しまして、俺
1546.0,1548.0,それでねえ、今ねえ、かなりねえ
1548.0,1550.0,自粛ムード、かなりねえ、その
1550.0,1552.0,新婚旅行は自粛ムードに
1552.0,1554.0,なってるんですけど
1554.0,1556.0,ちょっとねえ、まあでも、まあその
1556.0,1558.0,結婚前のことだから
1558.0,1560.0,結婚前のことだからさあ、まあそこはちょっとなんかさあ
1560.0,1562.0,水に流してやってくれよと
1562.0,1564.0,する前ならさあ、許してあげよう
1564.0,1566.0,ほんとだね、する前なんだからさあ、ちょっとさあ
1566.0,1568.0,許してあげてよと、そういう感じで
1568.0,1570.0,今ね、なんとか上手く仲を取り持ちまして
1570.0,1572.0,頑張ってやってるんですよ、ほんとに
1572.0,1574.0,でも付き合ってたんでしょ?まあそうだね
1574.0,1576.0,後輩あと何人で怒ってる?どういうこと?後輩あと何人で
1576.0,1578.0,後輩って何?
1578.0,1580.0,俺よくわかんない、後輩って言われて
1580.0,1582.0,エッチはしてたの?どういうこと?何の話ですか?
1582.0,1584.0,なんか28にもなるババアがねえ
1584.0,1586.0,そのさあ、彼氏とエッチしないとか
1586.0,1588.0,頭をか、あ、あ、すいません
1588.0,1590.0,会社の後輩ですか?あ、やめましたよ
1590.0,1592.0,私のねえ、会社の後輩
1592.0,1594.0,みーんな辞めてきました
1594.0,1596.0,なんとかねえ、これ上手くクーリングオフしまして
1596.0,1598.0,私自身がねえ、また恒例の下っ端に戻りまして
1598.0,1600.0,まあねえ、日々
1600.0,1602.0,成長してるんですけど
1602.0,1604.0,上もねえ、どんどん辞めてきまして
1604.0,1606.0,今崩壊の危機になります
1606.0,1608.0,危機になっておりますけど
1608.0,1610.0,いやでもねえ、全員っていうのはちょっとね
1610.0,1612.0,話もおったんだけど、一人だけ残ってる
1612.0,1614.0,俺の、俺の部下だけ残ってる
1614.0,1616.0,すごいでしょ?俺の部下が一番クズ
1616.0,1618.0,ほんとにね
1618.0,1620.0,俺の部下が一番クズなんだけど
1620.0,1622.0,そいつはやっぱりそうなんだね
1622.0,1624.0,なんと仕事ってのはさあ
1624.0,1626.0,やっぱやめないっていうのは重要だと思うんだよね
1626.0,1628.0,10人入ってきたんだけど、9人やめちゃったの
1628.0,1630.0,俺の部下が、部下っていうかね
1630.0,1632.0,俺の下についてるやつが一番仕事できなくて
1632.0,1634.0,ほんとに毒頭だ
1634.0,1636.0,毒頭、ほんとに毒頭だ
1636.0,1638.0,俺が優しい言葉かけただけで泣いちゃう
1638.0,1640.0,みたいなさあ
1640.0,1642.0,ほんとに
1642.0,1644.0,優しい言葉、だいじょうぶだよ
1644.0,1646.0,仕事でそういうミスしても
1646.0,1648.0,みんなそういう目で見てないから
1648.0,1650.0,優しい言葉かけただけで
1650.0,1652.0,泣いちゃうわけ
1652.0,1654.0,あいつ泣かしてんじゃねーのみたいな
1654.0,1656.0,嫌な悪気になるじゃないですか
1656.0,1658.0,泣き止むまで仕事終わるの待ってて
1658.0,1660.0,一緒にトイレ掃除して帰る
1660.0,1663.8,先輩…先輩面を…先輩風吹かしてますよ、ちゃんと
1663.8,1664.8,あ、ちょっと延長しますか
1664.8,1667.0,先輩風ちゃんと吹かして、頑張って…あ、放送してない
1667.0,1669.0,生放送してますよ、生放送じゃない、仕事してますよ
1670.0,1672.0,ちょっと待ってください、どこで延長すんの、俺
1672.0,1674.0,なんだチケットで30分延長って
1675.0,1679.0,俺チケ…そんな…俺そんな特権持ってんの、俺
1679.0,1681.0,なにこの超人気生主
1682.0,1684.0,なにチケットで30分延長って
1684.0,1687.0,なにこの超人気生主の特別待遇
1688.0,1690.0,でも押せないんだけど、これどういうこと?
1690.0,1691.0,なにこれどういうこと?
1692.0,1693.0,押せないんだけど
1694.0,1696.0,シルバー?ゴールド?なにこれ、シルバー使おうじゃん
1699.0,1700.0,できた?
1704.0,1705.0,これできた?
1706.0,1709.0,え、なにこれ、なんか360分延長みたいな機能がなくなっちゃったの
1711.0,1712.0,あ、残り時間吹いてる
1712.0,1715.0,3…360分…
1715.0,1717.0,いや、できてるできてるできてるできてるできてる
1717.0,1719.0,だって残り時間31分なってるよ
1720.0,1721.0,31分なってるよ、ほんとに
1722.0,1723.0,合ってるでしょ
1725.0,1727.0,いや、6時間やんない、6時間やんない、やんないですよ
1727.0,1729.0,いや、これが、今日髪切りに行くんでね
1729.0,1731.0,もう俺さ、1年と言ってる気がするんですけど
1731.0,1733.0,ちょっとね、私、私今日髪切りに行くんで
1733.0,1736.0,そんなにね、長時間放送はできないので安心してください
1736.0,1738.0,どうせどうけんちゃう、でもできないんだってほんとに
1738.0,1740.0,できないんだってほんとに
1741.0,1743.0,なので、そう、歯医者はね、行きました
1743.0,1747.0,あとね、奥歯の親知らずの虫歯をしっかり直しまして
1747.0,1749.0,あのね、頑張ってね、治療をしてますね、ほんとに
1749.0,1750.0,パープルやりません、ほんとに
1750.0,1751.0,パープルやりません
1751.0,1753.0,免許、免許更新したい
1753.0,1756.0,え、俺前の放送、前のさ、なんつーの
1756.0,1758.0,あれで言ったでしょ、免許更新しましたよ、ほんとに
1758.0,1762.0,更新、なんつーの、できなくなる2日前でギリギリしました
1762.0,1763.0,なのでギリギリね
1763.0,1764.0,え、コミュ障治った?
1764.0,1766.0,いや、もともとそんなにね
1766.0,1768.0,コミュニティ障害を持ってるってことじゃないんですよね
1768.0,1770.0,普通、ほんとにできるだけ
1770.0,1772.0,そういう人との関わりを
1772.0,1774.0,あんまり好きじゃないから
1774.0,1777.0,あんまりね、飲みの誘いとかはいかなかったけど
1777.0,1779.0,普通にね、会社とかでは
1779.0,1781.0,上司の人だかと
1781.0,1783.0,なんつーの、喋ったりもしますよ、ほんとに
1783.0,1786.0,仲のいい同期もできましたよ、いっぱい
1786.0,1787.0,ね、だからちょっとね
1787.0,1789.0,そういう人たちのね、またね
1789.0,1790.0,今ね、だってさ
1790.0,1791.0,生放送してなくなったからね
1791.0,1794.0,私ね、自転車で仕事がやってるんですよ、自転車で
1794.0,1795.0,汗だらだらかきながらさ
1795.0,1796.0,ね、その
1796.0,1798.0,あ、別にね、急いで帰って
1798.0,1799.0,枠取る必要もねえんだな、みたいな感じで
1799.0,1801.0,自転車で帰ってるんですよ
1801.0,1802.0,朝15分かけてさ
1802.0,1804.0,ね、ちょっと日焼けしてやろう、みたいな感じで
1804.0,1805.0,そういう人たちの
1805.0,1807.0,この歳で日焼けサロンとか行くの恥ずかしいなと思って
1807.0,1809.0,ちょっとね、そういう小賢しい真似して
1809.0,1810.0,朝ちょっと30分
1810.0,1812.0,自転車で通勤することにより
1812.0,1814.0,日焼けしちゃいましたよ、みたいな感じですが
1814.0,1816.0,そういう風に見せかけるために
1816.0,1818.0,頑張ってね、自転車で通勤してるんですけど
1818.0,1819.0,まあでも多分ね
1819.0,1821.0,えー、明日あたりからはね
1821.0,1823.0,タクシーでね、いっそいっそ帰ってきてね
1823.0,1825.0,早く、夜遅くなっちゃうと
1825.0,1827.0,隣人に怒られちゃう、みたいな感じで
1827.0,1829.0,また放送してしちゃうんじゃないのかなと
1829.0,1831.0,思っちゃうんで
1831.0,1833.0,ちょっとね、それは本当に懸念してます、本当に
1833.0,1835.0,それは本当に懸念してるんで
1835.0,1836.0,年考えるクソ爺
1836.0,1838.0,私まだね、25歳なんで
1838.0,1839.0,家にケッタロウ見てる?
1839.0,1841.0,いや、ケッタロウはちょっとまだ見てないと思います
1841.0,1843.0,あの人はね、多分仕事してると思いますんで
1843.0,1845.0,こんなね、クズの集まる放送にね
1845.0,1847.0,えー、見てないと思うんですけど
1849.0,1851.0,お前また配信で振られるぞ
1851.0,1853.0,それが本当怖いんですけど
1853.0,1855.0,今回は本当にちゃんと
1855.0,1857.0,自己管理していく、俺は
1857.0,1859.0,俺は自己管理していこうかなと思ってますんで
1859.0,1861.0,ケッタロウニートじゃないの?わかんない
1861.0,1862.0,俺歳も知らないし
1862.0,1864.0,ね、イケメンパラダイス
1864.0,1866.0,イケメンパラダイスに出てるみたいなさ
1866.0,1868.0,そういう情報しか俺、かねん会社知らないんでね
1868.0,1869.0,視聴率6%
1869.0,1870.0,マジでね、俺そのね
1870.0,1872.0,イケメンパラダイスが視聴率6%って
1872.0,1873.0,出た瞬間に
1873.0,1875.0,友達誘って飲みに来ましたからね、ほんとに
1875.0,1877.0,そういうやっぱね、うまい思いはしないといけないと思うんですよ
1877.0,1878.0,ほんとに
1878.0,1879.0,うまい思いは
1879.0,1881.0,ちょ、おめぇーぞ!
1881.0,1883.0,休んでる間、ねえ!
1883.0,1885.0,しっかり歌い手伝えてんのかなと思ったらさ
1885.0,1887.0,なんつーの、歌い手の放送も悪くねえよな
1887.0,1889.0,うんこちゃんがいなくなって
1889.0,1891.0,第3者目線で見てみたけど
1891.0,1893.0,歌い手の放送も悪くねえよな
1893.0,1895.0,見てたらさ、そういうさ、なんつーの
1895.0,1897.0,おめぇらがさ、ね、俺
1897.0,1899.0,おめぇらに任せた俺がバカだったらやっぱね
1899.0,1901.0,私自身、もう俺以外全員が許しても
1901.0,1903.0,絶対に許しません
1903.0,1905.0,私は、そういうね、なんつーのかな
1905.0,1907.0,幸せに
1907.0,1909.0,生放送を使ってね、幸せになろうと
1909.0,1911.0,してる奴らは、絶対に許しません
1911.0,1913.0,私はもうそこは絶対負けないんで安心してください
1913.0,1915.0,ほんとですよ
1915.0,1917.0,歌い手さん死ねとかそういうの言ってるわけじゃなくて
1917.0,1919.0,そんな
