start,end,text
2907.0,2909.0,お茶でも飲みながらね
2909.0,2911.0,聞いてくれた?俺地デジにしてないんだよね
2911.0,2913.0,地デジにしてないんだよ
2913.0,2915.0,地デジに全然してないから
2915.0,2917.0,ちょっとねやばいんだよ
2917.0,2919.0,やっぱニュースとかさ
2919.0,2921.0,いい歳も超えたおっさん26
2921.0,2923.0,弱い26
2923.0,2925.0,中堅ですよ本当に社会でも中堅
2925.0,2927.0,一番ね判断力決断力行動力
2927.0,2929.0,溢れてる年だと思う
2929.0,2931.0,25、6ってやっぱりね
2931.0,2933.0,皆さん私ねもう人生の先輩みんなの年でね
2933.0,2935.0,18、19、20くらいが多いチビ構想だから言いますけど
2935.0,2937.0,24、25、26
2937.0,2939.0,24、25、26っていうのはやっぱね人生で判断力決断力
2939.0,2941.0,もう想像力行動力
2941.0,2943.0,全部ねそのピークだと思うんですよ私は
2943.0,2945.0,そういう時に
2945.0,2947.0,どんどんインプットしていかないと
2947.0,2949.0,社会から置いていかれると思うんですね
2949.0,2951.0,ちょっとそういうニュースを見れないのは痛いんですけど
2951.0,2953.0,そこはヤフーニュースで代償して
2953.0,2955.0,迷ってんだよね
2955.0,2957.0,テレビ番組とか本当に見なくなっちゃってさ
2957.0,2959.0,ゴールデンの番組とかも
2959.0,2961.0,見れないしドラマとかもさ
2961.0,2963.0,仕事が不定期だから
2963.0,2965.0,帰ってくるのも遅いし
2965.0,2967.0,見れないんだよ全然
2967.0,2969.0,25あたりから始まるんだよ
2969.0,2971.0,お前いくつなのクソジジイじゃねえかよ
2971.0,2973.0,帰ってくださいクソジジイは
2973.0,2975.0,帰ってください本当に
2975.0,2977.0,私ちびっ子相手にしてネット勉強していたんで
2977.0,2979.0,クソジジイは本当に去ってくださいね
2979.0,2981.0,24歳以上は帰ってくださいね
2981.0,2983.0,キッズしかいらないんで
2983.0,2985.0,キッズしかいらないんで
2985.0,2987.0,日経新聞とか見るんだけど
2987.0,2989.0,かつじがあんま苦手じゃないんだよね
2989.0,2991.0,かつじがさ
2991.0,2993.0,苦手だからさ
2993.0,2995.0,そんなこと言っちゃいけないんだよね
2995.0,2997.0,なんかさ最近さ
2997.0,2999.0,みんなさ見てる?
2999.0,3001.0,額とかさ
3001.0,3003.0,なんつーのテレビ俺ね
3003.0,3005.0,直前で見てたんだけどさ額とかさ
3005.0,3007.0,なんつーの嵐とさ
3007.0,3009.0,モテる男ってこうだよ
3009.0,3011.0,みたいな感じで言ってたの
3011.0,3013.0,あいつだって俺ねここだけの嵐
3013.0,3015.0,額とデーモンこぐれの区別つかないからね
3015.0,3017.0,言っとくけど
3017.0,3019.0,そんな男にねモテる話とかされたくません
3019.0,3021.0,俺ね土俵際に額とかいたら
3021.0,3023.0,デーモンこぐれと区別つかないからねガチで
3023.0,3025.0,これねちゃんとタイムシフト
3025.0,3027.0,上げる人はちゃんとカットしてってくださいね
3027.0,3029.0,これガチでね
3029.0,3031.0,怒られちゃうんで
3031.0,3033.0,土俵際にいたら額とデーモンこぐれの区別
3033.0,3035.0,マジでつけませんよ
3035.0,3037.0,これは額と信者に荒らされても私は
3037.0,3039.0,しかと受け止めますけど
3039.0,3041.0,ほんとにこれ嘘でモテなくて
3041.0,3043.0,同じじゃないか
3043.0,3045.0,ほんとに
3045.0,3047.0,ねえ
3047.0,3049.0,そうやってさ
3049.0,3051.0,俺みたいなひねくれ者
3051.0,3053.0,天野ジャクは
3053.0,3055.0,こうやって言ったらモテるぜみたいなこと言われちゃうと
3055.0,3057.0,やっぱりちょっとね
3057.0,3059.0,額と信者エララしてきちゃうんですよ
3059.0,3061.0,額と信者いるよ
3061.0,3063.0,ニコ生とかでさ額とがいるとさ
3063.0,3065.0,ものすごいコメント400
3065.0,3067.0,100万とかいくじゃん
3067.0,3069.0,つじちゃんとカゴちゃんみたいな
3069.0,3071.0,めっちゃいい例えそれ
3071.0,3073.0,めっちゃいい例え
3073.0,3075.0,つじちゃんとカゴちゃんみたいな感じ
3075.0,3077.0,顔は大して似てないけどキャラとかさ化粧してるところとかさ
3077.0,3079.0,だってあいつさ丸せ見せるみたいな感じでさ
3079.0,3081.0,元はさ
3081.0,3083.0,死がないビジュアルなんすよ美女系のバンドでしょ
3083.0,3085.0,なんかちょっとね持ち上げられちゃってさ
3085.0,3087.0,もうちょっとなんつーの
3087.0,3089.0,ねえ
3089.0,3091.0,なんかちょっとさ謙虚な感じだったらさ
3091.0,3093.0,俺確かに額の方がかっこいい
3093.0,3095.0,俺より確かに額の方がかっこいいけど
3095.0,3097.0,俺よりは額の方がかっこいいだけど
3097.0,3099.0,なんかちょっとさ区別つかないところも
3099.0,3101.0,あるなっていう話です
3101.0,3103.0,別に悪口じゃなくてそういう価値観を
3103.0,3105.0,俺は持ってるよっていう話ですよ
3105.0,3107.0,悪口と捉えないでいただきたい
3107.0,3109.0,今日のリオンありませんよ伊藤リオンのコーナーは
3109.0,3111.0,ガチでやめてくださいっていうクレームが来たんでね
3111.0,3113.0,関係者からね
3113.0,3115.0,友人からねうんこちゃんリオンはマジで触れるなみたいな感じでね
3115.0,3117.0,あのおふれかけが来たので
3117.0,3119.0,ちょっと私自身かなりビビリなんでね
3119.0,3121.0,このインターネットじゃかなり行きがって
3121.0,3123.0,あーかかってこいよみたいな感じでやってますけど
3123.0,3125.0,かなりね日陰ものなんで
3125.0,3127.0,あんまりそういうことやめようと
3127.0,3129.0,関東連ほにゃららからね
3129.0,3131.0,目つけられたら本当にタチが悪いんでね
3131.0,3133.0,ちょっとそういうところは気をつけてね
3133.0,3135.0,やっぱ平和に放送していかなきゃいけないのかなと
3135.0,3137.0,ケッタロウってやつがイケメンパラダイス出てるよ
3137.0,3139.0,もうそれ4回目ですけど
3139.0,3141.0,どんだけお前どんだけ
3141.0,3143.0,ケッタロウ落としめてんだよ
3143.0,3145.0,俺むしろケッタロウちょっと好きだぞ俺
3145.0,3147.0,ケッタロウちょっと好きなのにむしろ
3147.0,3149.0,ちょっと勘違いしてる感が
3149.0,3151.0,絶対あいつ自分のことがかっこいいと思ってるだろ
3151.0,3153.0,俺言っとくけど
3153.0,3155.0,ケッタロウと天使少女の区別つかないからね
3155.0,3157.0,ケッタロウと天使少女の顔の
3157.0,3159.0,区別つかないからね
3159.0,3161.0,ちょっとねそこはちゃんと自分の
3161.0,3163.0,なんていうのかな
3163.0,3165.0,文相未文相みたいなさ
3165.0,3167.0,そういう感じの放送が好きなんですよ俺
3167.0,3169.0,だからちょっと
3169.0,3171.0,皆さんもあんまり勘違いしてはいけない
3171.0,3173.0,私自身も完全にね
3173.0,3175.0,勘違いをしてしまうこともあるんですけど
3175.0,3177.0,しっかりね
3177.0,3179.0,肝に銘じてね
3179.0,3181.0,同じような話繰り返すんじゃねえよ
3181.0,3183.0,ほらもう怒られた
3183.0,3185.0,開示53分で怒られた
3185.0,3187.0,早すぎないもうちょっとさ
3187.0,3189.0,ねえなんつうんこちゃんの声聞けて久々で
3189.0,3191.0,なんかよかったなみたいなさ
3191.0,3193.0,そういうコメントするでしょどう考えても
3193.0,3195.0,どう考えてもしかもさ
3195.0,3197.0,ちょっとコメビューで追ってみるとこいつさものすごい早さで来てるのに
3197.0,3199.0,ものすごい早さで俺の生放送に参加してるのに
3199.0,3201.0,いち早く参加して
3201.0,3203.0,いち早く飽きないでくださいね
3203.0,3205.0,俺の放送がつまらないのは俺のせいにしないでください
3205.0,3207.0,あなたの価値観がいけないという可能性もありますよ
3207.0,3209.0,ちゃんと楽しもうとして
3209.0,3211.0,放送聞けば
3211.0,3213.0,おのずと楽しめますので
3213.0,3215.0,俺のせいにしないでほしい全部
3215.0,3217.0,全部が全部俺のせいにせずに
3217.0,3219.0,聞き手側の問題もあるので
3219.0,3221.0,詮索するな
3221.0,3223.0,すみませんすみません
3223.0,3225.0,楽しいですよ
3225.0,3227.0,ちょっとぼちぼちぼちぼち
3227.0,3229.0,やっていかなきゃいけないのかなと思いますので
3229.0,3231.0,放送終わりますよ
3231.0,3233.0,これで放送終わります
3233.0,3235.0,youtubeのほうも運営再開しようと思いますので
3235.0,3237.0,みなさんもそう
3237.0,3239.0,最初はyoutubeでゲーム配信とかして
3239.0,3241.0,生ぬるくやろうかな
3241.0,3243.0,みたいな感じで思ったんだけど
3243.0,3245.0,次放送するときは絶対ニコ生でやるっていうね
3245.0,3247.0,自分のコミュで叩かれてもやります
3247.0,3249.0,どんどん1週間後に
3249.0,3251.0,もし放送したくなってしたとしても
3251.0,3253.0,絶対ここのコミュでやります
3253.0,3255.0,発言をしてしまいましたので
3255.0,3257.0,youtubeもぼちぼち
3257.0,3259.0,再開していこうかなと
3259.0,3261.0,思いますので
3261.0,3263.0,空白の2ヶ月については
3263.0,3265.0,ぼちぼち話していこうかなと
3265.0,3267.0,youtubeは本当にだめなんだよ
3267.0,3269.0,やりすぎちゃうと
3269.0,3271.0,ここ2ヶ月話してなかった
3271.0,3273.0,何してたかというと
3273.0,3275.0,仕事ばっかしてた
3275.0,3277.0,仕事付けだったね
3277.0,3279.0,彼女もできたから
3279.0,3281.0,皆さんとの思い出の
3281.0,3283.0,タイムシストニコニコに上がってる
3283.0,3285.0,うんこちゃんの雑談聞きながら
3285.0,3287.0,面白いなと
3287.0,3289.0,これね
3289.0,3291.0,またみんなから
3291.0,3293.0,ナルシストみたいな感じで言われちゃうんだけど
3293.0,3295.0,俺違うんだよ
3295.0,3297.0,自分自身のことがすごいタイプなの
3297.0,3299.0,よく言うじゃん
3299.0,3301.0,俺ってかっこいいなとか
3301.0,3303.0,俺って超面白いなみたいな感じじゃなくて
3303.0,3305.0,俺ってすごい自分自身の顔とか性格が
3305.0,3307.0,ものすごいタイプなの
3307.0,3309.0,だからナルシストとは本当にちょっと違うんだよね
3309.0,3311.0,本当に
3311.0,3313.0,ナルシストとはまた方向性が違う感じなんだけど
3313.0,3315.0,よくね自分の雑談放送とかは
3315.0,3317.0,聞くんですよ
3317.0,3319.0,本当に面白い
3319.0,3321.0,だからちょっとね
3321.0,3323.0,うんこちゃんがおすすめする
3323.0,3325.0,うんこちゃんの面白い雑談
3325.0,3327.0,タイムシフトみたいなのを
3327.0,3329.0,皆さんに見せますんで
3329.0,3331.0,本人のおすみつきなんだね
3331.0,3333.0,相当期待できるんじゃないのか
3333.0,3335.0,本人のおすみつきなんだね
3335.0,3337.0,そういうなんていうの
3337.0,3339.0,あった感じじゃなくて
3339.0,3341.0,普通のだらっとした
3341.0,3343.0,昨年の8月
3343.0,3345.0,昨年の8月ぐらいの放送で
3345.0,3347.0,お宝が埋まってんだよ
3347.0,3349.0,昨年の8月ぐらい
3349.0,3351.0,結構皆さん見てないでしょ
3351.0,3353.0,見てないでしょ
3353.0,3355.0,お宝が埋まってんだよ
3355.0,3357.0,皆さんにもしっかり
3357.0,3359.0,見ていただきたいなと思います
3359.0,3361.0,久しぶりの放送で
3361.0,3363.0,ものすごい緊張してきました
3363.0,3365.0,3時間ここだけの話ですよ
3365.0,3367.0,あーどうしようマジで
3367.0,3369.0,マジで叩かれるのめんどくせえ
3369.0,3371.0,せっかくそういう生活からなくなったのに
3371.0,3373.0,せっかく俺解放されたのに
3373.0,3375.0,って思ってさ朝の11時から
3375.0,3377.0,3時間ずっと回ったんですよ
3377.0,3379.0,ほんとにね3時間回ったんですよ
3379.0,3381.0,うわやりたくねえ
3381.0,3383.0,おなりでごまかそうとかさ
3383.0,3385.0,なんとかごまかしごまかし
3385.0,3387.0,3時間過ぎたんですけど
3387.0,3389.0,もうちょっとねやっぱね
3389.0,3391.0,ダメだなと
3391.0,3393.0,やりたかったんですよね
3393.0,3395.0,やりたかったんです
3395.0,3397.0,単純にねやりたかったんですって言うと
3397.0,3399.0,やりたくなっちゃったんです
3399.0,3401.0,やりたくなっちゃったんで
3401.0,3403.0,今回の勝負は
3403.0,3405.0,君たちの勝ちと
3405.0,3407.0,絶対やらないようにしようと
3407.0,3409.0,思ってたんですけどね
3409.0,3411.0,皆さんもね
3411.0,3413.0,いろいろね夏なんで
3413.0,3415.0,いろいろ大変なね
3415.0,3417.0,時期だと思いますので
3417.0,3419.0,また一緒に
3419.0,3421.0,頑張っていこうよ
3421.0,3423.0,もうちょっとね
3423.0,3425.0,怖いですけど頑張っていこうかなと
3425.0,3427.0,頑張っていこうかなと
3427.0,3429.0,思っております今日は仕事じゃないです
3429.0,3431.0,休みです髪を切りに行きます
3431.0,3433.0,それでは皆さん
3433.0,3435.0,恒例の尺余り
3435.0,3437.0,ちょっと早いですけどね
3437.0,3439.0,お疲れ様でした
3439.0,3441.0,さようなら
3451.0,3453.0,どこ
3475.0,3477.0,俺はこいつが悪党ばっかり
3477.0,3479.0,金使ってるからさ
3479.0,3481.0,燃料市民がさ
3481.0,3483.0,放送切れないような事態になるんだって本当に
3483.0,3485.0,使い方が違ぇんだよ
3485.0,3487.0,どこで切るんだよマジで
3487.0,3489.0,ガチで分からんあったあった
