start,end,text
0.0,2.0,【音声なし】
30.0,56.0,音声なし
56.0,59.0,こんにちは
59.0,63.0,こんにちは
63.0,64.0,えー
64.0,66.0,ちょっとね
66.0,67.0,えー
67.0,69.0,まあそういうわけです
69.0,70.0,ちょっとね
70.0,71.0,えー
71.0,73.0,まあいろいろありまして
73.0,74.0,まあね
74.0,76.0,ちょっと私今手が震えてるんですけど
76.0,77.0,ちょっとね
77.0,78.0,まあ
78.0,80.0,楽しんでいただければなと
80.0,81.0,思います
81.0,82.0,うんこちゃんです
82.0,84.0,こんにちは
84.0,85.0,まあちょっとね
85.0,86.0,なんで
86.0,87.0,いきなりね
87.0,90.0,こういう枠を取らせていただきましたかというと
90.0,91.0,まあほんとにね
91.0,92.0,昨日まで
92.0,94.0,私ほんとにね
94.0,95.0,なんていうのかな
95.0,96.0,普通に暮らしてたんですよ
96.0,97.0,ほんとに
97.0,98.0,普通に暮らしてたんですね
98.0,99.0,マジで
99.0,100.0,んでね
100.0,101.0,友人から
101.0,102.0,うんこちゃんニコ生やろうぜ
102.0,103.0,みたいな
103.0,104.0,あのなんていうのかな
104.0,107.0,その誘いも多々あったんですけど
107.0,108.0,いやいいよと
108.0,110.0,そんなのもうやらねえと
110.0,111.0,あいつらバカだよと
111.0,112.0,クズだよと
112.0,114.0,どうせやってもうなちゃんマンとかね
114.0,116.0,石川のりゅうきとかに悪口言われて
116.0,118.0,ねえいい思いなんか一個もねえよと
118.0,120.0,そういう風に言ってたんですよガチでね
120.0,121.0,本気で
121.0,122.0,これ嘘じゃないですほんとに言ってたんです
122.0,123.0,ただ
123.0,124.0,本日ね
124.0,125.0,えー
125.0,128.0,仕事のシフトが発表されまして
128.0,129.0,なんていうのかな
129.0,131.0,そのー
131.0,132.0,えー
132.0,134.0,8月のね休みが4日しかなくて
134.0,135.0,ちょっとね
135.0,137.0,なんていうのかな
137.0,139.0,一気にね心の何かが
139.0,140.0,弾けまして
140.0,143.0,あの忍が魔界で死にたいと
143.0,144.0,そういった時みたいな感じで
144.0,146.0,一気にほんとにね
146.0,147.0,心のなんていうのかな
147.0,149.0,そういうのがバチって外れまして
149.0,151.0,もうだめだと
151.0,152.0,もうこれできねえと
152.0,153.0,それ俺ね
153.0,155.0,8月に私
155.0,157.0,誕生日があるんですけど
157.0,158.0,なんていうのかな
158.0,159.0,そのー
159.0,161.0,当日ね会社の
161.0,162.0,そのー
162.0,163.0,会社でちょっとね
163.0,165.0,徹夜で勤務をしなきゃいけない
165.0,167.0,用事ができまして
167.0,168.0,不可能だなと
168.0,170.0,あそうでもチャンスはね
170.0,172.0,何気にね完全にフリーター
172.0,173.0,フリーターじゃないですよ
173.0,174.0,意外にね
174.0,175.0,まあそう
175.0,177.0,そういう理由で辞めたじゃないですか
177.0,178.0,ちゃくちゃくとね
178.0,179.0,月収の方増やしてまして
179.0,180.0,2ヶ月間でね
180.0,182.0,なんて4万円
182.0,184.0,しまなこになって働きまして
184.0,185.0,私
185.0,186.0,2ヶ月間でだいたいね
186.0,188.0,月収の方4万円ぐらい
188.0,189.0,上がりました
189.0,190.0,すごいじゃない
190.0,191.0,すごいんですよ
191.0,192.0,意外に
192.0,194.0,意外にすごくてですね
194.0,195.0,ちょっとね私今
195.0,197.0,緊張すごくしてまして
197.0,199.0,また叩かれるんだろうな
199.0,201.0,また叩かれるのに耐える日々
201.0,203.0,俺全然気にしてないよ
203.0,205.0,っていう日々が始まるのかなと
205.0,207.0,思うとかなりちょっとね
207.0,208.0,悲しいんですけど
208.0,209.0,サバコ一本吸ってからね
209.0,211.0,本題の方に入っていこうかなと
211.0,212.0,思います
212.0,213.0,ちょっと待ってください
215.0,216.0,なんかさこのさ
216.0,217.0,なんていうの
217.0,218.0,俺のさ
218.0,219.0,あれじゃなくなってんだけど
219.0,220.0,なんかトップページがさ
220.0,221.0,トップページじゃなくてさ
221.0,222.0,なんていうの
222.0,223.0,青い
223.0,224.0,青いさ
224.0,225.0,あれになってんだけど
225.0,226.0,これどういう
226.0,227.0,あれなんだろうね
227.0,228.0,なんかうまくさ
228.0,229.0,なんかできねえの
230.0,231.0,うまくできないのこれ
232.0,233.0,これ青をさ
233.0,234.0,いつものさあれにできないの
235.0,236.0,青の
238.0,239.0,そうそうそうそう
240.0,241.0,なんかいつものさあの
241.0,243.0,目に優しい方法に
243.0,244.0,めっちゃ震えてる
244.0,245.0,そういう
245.0,246.0,そういうあれじゃないんですよ
246.0,247.0,もういつあれ
247.0,248.0,分かんねえんだよ
248.0,249.0,こういうのさよく分かんねえ
249.0,250.0,よく分かんないんだってこういうのが
250.0,251.0,システムみたいなのが
253.0,254.0,どうやって直すの
254.0,255.0,放送の設定か
255.0,256.0,これか
257.0,258.0,いいんじゃないかこれで
259.0,260.0,できたんじゃないか
260.0,261.0,いつものボイスに
262.0,263.0,戻ったんじゃないか
264.0,265.0,俺の
266.0,267.0,俺のボイスに
268.0,269.0,戻ったんじゃないか
269.0,270.0,これで
271.0,272.0,もうというわけでね
272.0,273.0,えー
273.0,274.0,まあ今日ぐらいはね
274.0,275.0,ゆっくり付き合っていただければなと
275.0,276.0,思っております
277.0,278.0,まあ相変わらずずっとね
278.0,279.0,的厳しい声をいただきまして
280.0,281.0,まあちょっとね
281.0,282.0,まあまた
282.0,283.0,えー
283.0,284.0,まあそんなにね
284.0,285.0,なんとなく頑張って
285.0,286.0,そんなにね
286.0,287.0,なんとなく頑張るみたいに
287.0,288.0,もう本当にね
288.0,289.0,もう俺は
289.0,290.0,本当にもう
290.0,291.0,毎日は絶対しない
291.0,292.0,もう絶対
292.0,293.0,毎日放送するんだったら
293.0,294.0,首切って死にます
294.0,295.0,本当に
295.0,296.0,自殺配信するんで
296.0,297.0,ちょっとね
297.0,298.0,それだけは本当に
298.0,299.0,肝に銘じて
299.0,300.0,自分でやっていこうかなと
300.0,301.0,本当にね
301.0,302.0,私もね
302.0,303.0,本当に突然なの
303.0,304.0,本当に突然なの
304.0,305.0,お前ら気を付けろよ
305.0,306.0,本当に突然訪れるぞ
306.0,307.0,本当に
307.0,308.0,本当に俺で
308.0,309.0,昨日まで本当にね
309.0,310.0,自分のコミュニティーすら
310.0,311.0,確認してなかったんだよ
311.0,312.0,本当に
312.0,313.0,自分のコミュニティーすらね
313.0,314.0,確認してなかったのに
314.0,315.0,いきなりだからね
315.0,316.0,心の風が
316.0,317.0,パカッと外れるのは
317.0,318.0,だから皆さんもね
318.0,319.0,気を付けてくださいね
319.0,320.0,本当に
320.0,321.0,本当に気を付けてください
321.0,322.0,意地弱いな
322.0,323.0,本当だよ
323.0,324.0,本当に今回ばっかりは
324.0,325.0,ね
325.0,326.0,俺もやめたなと
326.0,327.0,こいつらマジで弱えなと
327.0,328.0,本当に
328.0,329.0,お前ら悲しがってんだろと
329.0,330.0,俺がいなくなって
330.0,331.0,悲しいんじゃないかと
331.0,332.0,そういう風にね
332.0,333.0,言ってたんですけど
333.0,334.0,思ってたんですけど
334.0,335.0,やっぱりね
335.0,336.0,なんていうのかな
336.0,337.0,なんか覚醒団みたいなもんなんですね
337.0,338.0,もう田代正史みたいなもん
338.0,339.0,本当に
339.0,340.0,いきなりね
340.0,341.0,本当にいきなりなんですよ
341.0,342.0,こういうのって
342.0,343.0,で私のね
343.0,344.0,人生の
344.0,345.0,なんていうのかな
345.0,346.0,座右の銘として
346.0,347.0,迷ったらやれと
347.0,348.0,迷ったらやれ
348.0,349.0,どんなにね
349.0,350.0,どういう境遇でも
350.0,351.0,迷ったらとにかく
351.0,352.0,やっていこうかしろと
352.0,353.0,そういう風にね
353.0,354.0,私人生の座右の銘を
354.0,355.0,持ってますので
355.0,356.0,やろうと
356.0,357.0,思って
357.0,358.0,朝の11時から
358.0,359.0,なんとかして
359.0,360.0,みんなに叩かれないように
360.0,361.0,なんとかして
361.0,362.0,綺麗に復活しよう
362.0,363.0,みたいなこと
363.0,364.0,ずっと考えてたんですけど
364.0,365.0,それは不可能かなと
365.0,366.0,なんとかしてね
366.0,367.0,いい理由を考えて
367.0,368.0,ね
368.0,369.0,なんかそういう考え方
369.0,370.0,いい理由を考えて
370.0,371.0,ね
371.0,372.0,なんかそういう
372.0,373.0,かっこいい理由あるじゃないですか
373.0,374.0,お前らが
374.0,375.0,なんていうの
375.0,376.0,コメントなんかさ
376.0,377.0,やっぱりさ
377.0,378.0,お前らのこと裏切れねえよ
378.0,379.0,みたいなさ
379.0,380.0,そういうね
380.0,381.0,めっちゃかっこいい
381.0,382.0,それみたいな
382.0,383.0,いっぱい考えたんですけど
383.0,384.0,ちょっとねやっぱ
384.0,385.0,やっぱり私が
385.0,386.0,泥をかぶらないと
386.0,387.0,いけないなと
387.0,388.0,そういうね
388.0,389.0,言いましたね
389.0,390.0,単純に心のね
390.0,391.0,なんていうのかな
391.0,392.0,枷が本当にパカッと
392.0,393.0,外れました
393.0,394.0,8月のシフトを見て
394.0,395.0,休みが4日しかなくてね
395.0,396.0,心の枷がね
396.0,397.0,パカッと外れました
397.0,398.0,なのでちょっとね
399.0,400.0,ちょっとね
400.0,401.0,一枠二枠くらいやろうかなと
402.0,403.0,思ってますんで
403.0,404.0,皆さんもね
404.0,405.0,どうされるでしょう
405.0,406.0,お前ら暇なんだろこの時間
406.0,407.0,ねえ
407.0,408.0,月曜日のね
408.0,410.0,月曜日の2時30分に
410.0,411.0,ねえ
411.0,412.0,放送に見れるってことは
412.0,413.0,結構ね
413.0,414.0,それ層のね
414.0,415.0,人種だと思いますので
416.0,417.0,ちょっと付き合っていただければなと
417.0,418.0,俺あれなんだよね
418.0,419.0,このさ
419.0,420.0,あれにしたいんだけど
420.0,421.0,いつものさ
421.0,422.0,グリーンボックスにしたいんだけどさ
423.0,424.0,どうやってやればいいのこれ
424.0,425.0,教えて誰か
425.0,426.0,グリーンボックスにしたいんだけど
427.0,428.0,SCFHを立ち上げなきゃいけないの
430.0,431.0,超かっこよかったのに
431.0,432.0,俺やめてて
433.0,434.0,超かっこ
434.0,435.0,やばいやばいやばい
436.0,437.0,ちょっと待ってね
437.0,438.0,SCFHを開きます
441.0,442.0,ハズレ枠ですよ
442.0,443.0,基本的にハズレ枠以外
443.0,444.0,できないんでね私
447.0,448.0,待ってくださいね
450.0,451.0,止まった止まった止まった
451.0,452.0,よしよし
453.0,454.0,かっこいいでしょ
454.0,455.0,どう考えても
457.0,458.0,待ってくださいね
459.0,460.0,いろいろ離さなきゃいけないこと
460.0,461.0,あるでしょ
463.0,464.0,どうこれで
465.0,466.0,直った?
467.0,468.0,どうすればいいの俺
468.0,469.0,教えて
470.0,471.0,一回ちょっとあれだ
471.0,472.0,F5押すわ
472.0,473.0,さよなら
482.0,483.0,ちょっと待って
508.0,509.0,戻ったんじゃないかこれで
510.0,511.0,もっとね
511.0,513.0,新しい緑だったはずなんですけど
513.0,515.0,まぁちょっとね
515.0,517.0,これでやっていこうかなと
517.0,519.0,思います。よろしくお願いします。
519.0,521.0,早くもね、何を喋っていいのか分からないと
521.0,524.0,いう窮地に立たされてますけど
524.0,527.0,まぁちょっとね、ここは何とかしのいでいこうかなと
527.0,530.0,もう大丈夫ね。30分くらいは何とかしてね
530.0,532.0,しのいでいこうかなと思います。でも本当にね
532.0,535.0,これね、また皆さんに怒られちゃうかもしれませんけど
535.0,538.0,あのー、ニコ生でね、どういうことがあったのかって
538.0,540.0,本当にね、聞きたかったんですよ。何が起きたんだと
540.0,542.0,私ね、本当にね、やっぱり見てると
542.0,544.0,どうしてもやりたくなっちゃうじゃないですか
544.0,546.0,見てるとどうしてもやりたくなっちゃうから
546.0,548.0,できるだけ見ないようにしてたんですよ。本当に
548.0,550.0,できるだけ見ないようにしてたんですけど
550.0,552.0,何かがね、何があったのかなと
552.0,554.0,思いました。それは視聴者から聞けばいいかなと
554.0,556.0,思いましたので。ハムハムが割れした
556.0,558.0,あー、なるほどね。割れっていうのは
558.0,560.0,あれかな?トレンド的な何かなのかな?
560.0,562.0,まぁそういうね、なんていうのかな
562.0,564.0,色々ね、事件みたいなのも
564.0,566.0,多発してると思うんですけど
566.0,568.0,まぁちょっとね、えー
568.0,570.0,まぁ皆さんがね、おんびんに
570.0,572.0,済ませていただければなと思いますよ。本当に
572.0,574.0,ジュケとキューピーの喧嘩。それ俺
574.0,576.0,見てましたよ。実際
576.0,578.0,え、まだそれはもう2、3ヶ月前でしょ
578.0,580.0,2、3ヶ月前でしょ。それは
580.0,582.0,違うの?
582.0,584.0,俺それ見てたよ。本当に
584.0,586.0,ちょくちょくね、なんかそういうのね
586.0,588.0,ニコファーレ。はい、出ました
588.0,590.0,ニコファーレ。待ってました。私もね
590.0,592.0,そのね、やっぱり言いたかったんですよ。本当に
592.0,594.0,ね、なんかさ、あれ
594.0,596.0,昔のベルファーレでしょ
596.0,598.0,ベルファーレをさ、ニコニコ動画じゃ
598.0,600.0,ドワンゴが嗅いどってさ、ねえ
600.0,602.0,なんかさ、ニコファーレ
602.0,604.0,みたいな感じでさ、やってるじゃないですか
604.0,606.0,今。なんかね、私も
606.0,608.0,どうかなと思いますけど
608.0,610.0,でも、私ね、クラブとかね
610.0,612.0,以前、昔結構行ってたんで
612.0,614.0,あれはいいのかなと思うんですけど、あれって
614.0,616.0,歌い手の人たちが
616.0,618.0,ライブをやって
618.0,620.0,そこの会場になってるんでしょ、今
620.0,622.0,サイリウムコメント
622.0,624.0,30個目300円。あ、金取るんだ
624.0,626.0,なんかそういう商売してるんだね
626.0,628.0,有料で込めてしまう。あー、なるほどね
628.0,630.0,だからちょっとなんかそういうさ
630.0,632.0,本物もいる。なるほどね
632.0,634.0,いや、ポコ太はクズだよ
634.0,636.0,ありがとうございます。早速ね、そういう
636.0,638.0,なんていうのかな、俺の好感度を
638.0,640.0,下げるようなコメントをね、書いていただきまして
640.0,642.0,ありがとうございます。ポコ太はね
642.0,644.0,視聴者に言わせればクズだと。あ、そう
644.0,646.0,たちみのうんこちゃん見てやんないと
646.0,648.0,ごめんなさいね、なんか
648.0,650.0,えー、どこだ。これか
650.0,652.0,七面鳥か
654.0,656.0,たちみのうんこちゃん、俺全然ほんとにさ、突然だったからさ
656.0,658.0,何の準備もしてなくて
658.0,660.0,ちょっと待ってね
660.0,662.0,消しちゃったかな、俺、コメビュー
662.0,664.0,これか?
664.0,666.0,あったあった
668.0,670.0,アトリウムフレンズ直してないぞ
670.0,672.0,ねーやとけったろドラマ出演
672.0,674.0,ざけんじゃねーよと
674.0,676.0,ほんとに
676.0,678.0,そういうのいろいろ言いたかったんですよ、ほんとに
678.0,680.0,ちょっと待ってくださいね。けったろのドラマ出演
680.0,682.0,俺の方が絶対にかっこいいからね
682.0,684.0,かっこ、まじで、ほんとに
684.0,686.0,これ嘘じゃなくて、俺けったろより全然かっこいいから
686.0,688.0,ほんとに、まじで、嘘じゃないよ
688.0,690.0,これ
690.0,692.0,ほんとに嘘じゃねえ
692.0,694.0,なんていうのかな、あとさ
694.0,696.0,それはあとで言うよ
696.0,698.0,ほんとに嘘じゃないんだよ、俺けったろより全然かっこいいんだって
698.0,700.0,まじで
700.0,702.0,頭は確かにでかい
702.0,704.0,なんていうの、顔の作りみたいなのは
704.0,706.0,俺の方が絶対かっこいいから
706.0,708.0,確かに頭はでかいよ、俺は
708.0,710.0,六等身のイケメンって言われてたからね
710.0,712.0,すずきみたいなもんだ
712.0,714.0,ちょっと待ってくださいね
714.0,716.0,あ、超緊張する
716.0,718.0,まじで
718.0,720.0,すげえ後悔してる今
720.0,722.0,あ、たちみしー出てる
722.0,724.0,ありがとうございます。たちみしーのうんこじゃん
724.0,726.0,負け犬うんこじゃん
726.0,728.0,ちょっと待ってくださいね
730.0,732.0,バーカ
732.0,734.0,どういうことだよ
736.0,738.0,帰りませんよ
738.0,740.0,視聴率6%
740.0,742.0,なるほどね
742.0,744.0,そういう飯がうまい話もありますけど
744.0,746.0,ちょっとね、なんていうのかな
746.0,748.0,俺はね、でも腹が立ってるんですよ
748.0,750.0,ほんとに
750.0,752.0,腹が立ってることがほんとにあって
752.0,754.0,いつかね、もし俺が生放送復活したら
754.0,756.0,言ってやろうと思ってたことがいっぱいあるんですけど
756.0,758.0,ほんとにね、緊張しちゃいまして
758.0,760.0,あ、俺彼女できたよ
760.0,762.0,言ってなかったっけ?
762.0,764.0,彼女ができたんですけど
764.0,766.0,ちょっとね、その話も
766.0,768.0,おいおいね、おいおい伝えていければなと
768.0,770.0,思いますので
770.0,772.0,そうなんですよ
772.0,774.0,そういうなんていうのかな
774.0,776.0,彼女の一人でもいないと
776.0,778.0,落ち着かないじゃないですか
778.0,780.0,ちゃんと今回は結婚します
780.0,782.0,結婚します
782.0,784.0,プロポーズして子供ができましたって報告も
784.0,786.0,皆さんにさせていただければなと
786.0,788.0,結婚しますほんとに
788.0,790.0,言ってたじゃん前から
790.0,792.0,次付き合った彼女と結婚する
792.0,794.0,っていう話をよくしてたじゃないですか
794.0,796.0,だからうまくいったらね
796.0,798.0,皆さんにもちゃんとしっかり報告をしますので
798.0,800.0,何の動物に似てるの?
800.0,802.0,イグアナみたいな顔してます
802.0,804.0,今回の彼女はね、なんとね
804.0,806.0,皆さんも大好きイグアナのような顔してまして
806.0,808.0,私ね、爬虫類顔大好きなんですよ
808.0,810.0,爬虫類みたいな顔ほんとに大好きで
810.0,812.0,本当にイグアナに似てます
812.0,814.0,なので、うちのイグアナちゃんをね
814.0,816.0,今度ね、皆さんにも紹介する機会
816.0,818.0,あると思いますので
818.0,820.0,まあちょっとね、そのせいで
820.0,822.0,皆さんよろしくお願いいただければなと
822.0,824.0,彼女にニコ生やってるって言うんだよね
824.0,826.0,まあそうですね、もうやっちゃったんで
826.0,828.0,私ね、隠し事とかは大っ嫌いなんで
828.0,830.0,もし、あれね、いつも
830.0,832.0,このままね、またテクノに戻ってしまったら
832.0,834.0,私は、なんていうのかな
834.0,836.0,彼女に
836.0,838.0,ちゃんと説明をしなきゃいけないなと
838.0,840.0,ちゃんと、今私は
840.0,842.0,ニコニコ生放送でうんこちゃんとして
842.0,844.0,頑張ってるよと、見てくれよと
844.0,846.0,平日の2時からこんなにね、クズども集めて
846.0,848.0,人の悪口言ってるよと
848.0,850.0,そんな俺かっこいいだろと
850.0,852.0,そういう方をね、彼女に
852.0,854.0,焼き付けていただきたいんで
854.0,856.0,やっぱりね、若いうちしかできないことなんでね、こういうのもね
856.0,858.0,なんで、ちょっとやっていただければな
858.0,860.0,やっていこうかなと、思います
860.0,862.0,早いとこ告白したほうがいい、いやでもさ
862.0,864.0,時期焦燥じゃないか
864.0,866.0,なんかね、その、敵礼器みたいなのもあるじゃん
866.0,868.0,なんかさ、若いうちにさ
868.0,870.0,結婚しまったらなんかちょっとさ
870.0,872.0,それこそなんかさ
872.0,874.0,いろいろさ、なんか、なんていうの
874.0,876.0,嫌なこととかいっぱいあるじゃないですか
876.0,878.0,ちょっとそれは、時期を見て1年2年
878.0,880.0,やってね、それでプロポーズをしようと思います
880.0,882.0,ちょっとタバコ吸わしてください
888.0,890.0,うんこ自分から吹きとか
890.0,892.0,思ってるよりダセェぞ
892.0,894.0,ありがとうございます、りんなさんはね
894.0,896.0,さすがに厳しいコメントがあるんですけども
896.0,898.0,そういうコメントをね、全て私は受け止めて
898.0,900.0,これからも頑張っていこうかなと
900.0,902.0,頑張っていこうかなと、思いますので
902.0,904.0,みなさんもね、温かいね
904.0,906.0,コメントをね、していただければ
906.0,908.0,はい、普通さ、だってさ
908.0,910.0,一枠目とかさ、だってさ
910.0,912.0,なんつーの、うんこちゃんおかえり
912.0,914.0,みたいなのさ、あふれるじゃない
914.0,916.0,なんでさ、いきなりさ、そういうさ、なんつーの
916.0,918.0,ねえ
918.0,920.0,普通さ、一枠目とかさ
920.0,922.0,なんつーの、あーうんこちゃんありがとう
922.0,924.0,ほんとに待ってたよ、みたいなさ
924.0,926.0,そういうコメントでさ
926.0,928.0,どんだけこれNGコメントあんの
928.0,930.0,どんだけさ、NGコメントがあるんですか
930.0,932.0,もうそういうね、チミですから
932.0,934.0,チミ猛竜がばっこするようなね
934.0,936.0,世界に私自身、ちゃんとしたなんつーの
936.0,938.0,一社会人のようなね
938.0,940.0,身のある時間を過ごそうと思ってますんで
940.0,942.0,みなさんもほんとにね、甘えないでくださいね
942.0,944.0,ほんとに
944.0,946.0,甘えないでくださいね、ほんとに
946.0,948.0,これタイムシフト残すんじゃないですか、わかんないですけど
948.0,950.0,残ってる設定だと思いますので
950.0,952.0,キャーキャー言われてアイドルグみたいなの
952.0,954.0,まあそうなんですよ、多少なんかさ、やっぱそういう気持ちってあるじゃないですか
954.0,956.0,私もね、だから俺だってさ
956.0,958.0,俺ね、マジで腹立ってんだけどさ
958.0,960.0,また怒られちゃうわけでさ
960.0,962.0,あれさ、なんつーの、ニコ生映画祭みたいなの
962.0,964.0,あったじゃん、ニコ生映画祭
964.0,966.0,2ヶ月くらい前に、知ってます?
966.0,968.0,見ました?みなさん
968.0,970.0,暗黒放送とペニオのやつ
970.0,972.0,見ました?あれ
972.0,974.0,そうそうそう、俺ね
974.0,976.0,ああいうのすげー、俺映画好きじゃないですか
976.0,978.0,映画、映画好きじゃないですか
978.0,980.0,でさ、なんかみんなね
980.0,982.0,なんつーの、か、なんかすげー有名な
982.0,984.0,生主さんとかさ
984.0,986.0,なんつーの、そのーね
986.0,988.0,あのー
988.0,990.0,宣伝してるわけ、頼まれて
990.0,992.0,宣伝してるわけ、みんなすげー有名な生主が
992.0,994.0,でさ、やっぱりさ、なんつーの
994.0,996.0,そういうのってさ、やらしいけど
996.0,998.0,ああ、俺のところにも来るんじゃねーかなと
998.0,1000.0,俺のところにも来るんじゃねーのかなと
1000.0,1002.0,そういう気持ちになるじゃないですか、みなさんも思うでしょ
1002.0,1004.0,ほんとに、ああうんこちゃんも来るんだろうな
1004.0,1006.0,みたいな感じで、来るじゃないですか
1006.0,1008.0,そういうね、思いあるじゃないですか
1008.0,1010.0,私自身も、例に漏れなく
1010.0,1012.0,そういうね、なんつーのかな
1012.0,1014.0,気持ちであったんですよ、気持ちがね、そういう気持ちが
1014.0,1016.0,あったんですけど、まあちょっとね
1016.0,1018.0,来なかったんですね
1018.0,1020.0,なんかさ、ああ、なんつーの
1020.0,1022.0,ナレーター、ナレーションだけだったらさ
1022.0,1024.0,別に顔出しとかさ、関係ないじゃん
1024.0,1026.0,別に俺にもさ、やらしてくれっていいじゃん
1026.0,1028.0,なんかちょっとさ、そういうなんつーの
1028.0,1030.0,俺、人気者だよな、みたいなさ
1030.0,1032.0,そういうさ、なんつーの
1032.0,1034.0,気分にさせてくれてもいいじゃん、ほんとに
1034.0,1036.0,タケノコに迷惑かけんなと、分かるんですか
1036.0,1038.0,タケノコに俺迷惑かけてないですよ、ほんとに
