start,end,text
1919.0,1921.0,歌い手死ねって言ってるわけじゃなくて
1921.0,1923.0,そのね、抗議に、幸せになろうなんて
1923.0,1925.0,ちょっとさ、やっぱりちょっとさ
1925.0,1927.0,百日あれずるいじゃないですか、ほんとに
1927.0,1929.0,ずるいじゃないですか、ほんとに
1929.0,1931.0,だからちょっとねえ、なんかねえ、その
1931.0,1933.0,ねえ、やって
1933.0,1935.0,普通にね、でもやっていこうかなと
1935.0,1937.0,黒猫とモコンの戦争見たら
1937.0,1939.0,黒猫とモコンの戦争
1939.0,1941.0,何黒猫とモコンの戦争
1941.0,1943.0,黒猫知らねえから俺わかんねえけどさ
1943.0,1945.0,まあ相変わらず
1945.0,1947.0,別にそういうね、なんつーのかな
1947.0,1949.0,そういうさ、物数の話をさ
1949.0,1951.0,なんつーのかな、もうさておいて
1951.0,1953.0,普通に雑談していこうかなと
1953.0,1955.0,誰の動画荒らさばいいと思う
1955.0,1957.0,誰の動画荒らさばいいんだよ
1957.0,1959.0,動画なんて荒らさなくていいですよ
1959.0,1961.0,見たよ見たよ、ほんとに
1961.0,1963.0,見ましたよ、公式のやつでしょ
1963.0,1965.0,なんかいい加減にさ
1965.0,1967.0,ねえ
1967.0,1969.0,あと
1969.0,1971.0,アブのアイドル放送
1971.0,1973.0,アブのアイドル放送
1973.0,1975.0,ものすごい俺叩いてやりましたけどね
1975.0,1977.0,ものすごい叩いてやりました
1977.0,1979.0,そういうのは、じゃあ確かに
1979.0,1981.0,俺たちは仲間ですよ
1981.0,1983.0,確かに同じ穴の無事な
1983.0,1985.0,だけど
1985.0,1987.0,仲間で会ったとはいえ
1987.0,1989.0,道を反るな人間は私は絶対許さないので
1989.0,1991.0,そういうこと
1991.0,1993.0,そういうね、なんつーのかな
1993.0,1995.0,自分を抱えて放送みたいなの
1995.0,1997.0,明月には私嫌われる覚悟で
1997.0,1999.0,私嫌われる覚悟で
1999.0,2001.0,184外して荒らしましたから
2001.0,2003.0,ちゃんとそこは男らしくね
2003.0,2005.0,184付けて荒らしてやろうかなと思ったんですけど
2005.0,2007.0,そこは自分が嫌われる覚悟で
2007.0,2009.0,184外して
2009.0,2011.0,かかってこいよと
2011.0,2013.0,いう感じで荒らしまして
2013.0,2015.0,ちょっとね
2015.0,2017.0,痛い目を見ましたので
2017.0,2019.0,9割嘘、いやほんとですよ
2019.0,2021.0,しっかりね、既に嫌われてる
2021.0,2023.0,どんどんどんどんさ
2023.0,2025.0,ねえ、その
2025.0,2027.0,嫌われていってしまって
2027.0,2029.0,昔はねえ、なんつーのちょっとさ
2029.0,2031.0,ねえ、なんか声もかかったりもしてたんですよ
2031.0,2033.0,アブさんからさ
2033.0,2035.0,ねえちょっと生放送しようようんこじゃんみたいなさ
2035.0,2037.0,そういう誘いもあったりさ
2037.0,2039.0,コミュニー人数が伸びて俺を抜かしたら
2039.0,2041.0,もうまるっきり相手しないと
2041.0,2043.0,あいつ荒れちゃうからねみたいな感じで
2043.0,2045.0,もうカヤの外です
2045.0,2047.0,そういうね、なんつーの昔から
2047.0,2049.0,俺はね、水地がいくら名偉だろうが犯罪者だろうが
2049.0,2051.0,私は水地捨てませんよ絶対
2051.0,2053.0,もうね、絞り
2053.0,2055.0,水が出ないボロ雑巾まで
2055.0,2057.0,絞り取ってから
2057.0,2059.0,もうサイクル脳になるまで俺はちゃんと面倒見ますから
2059.0,2061.0,なので、いやホモじゃありません
2061.0,2063.0,私はホモじゃありません
2063.0,2065.0,ホモじゃないんですけど
2065.0,2067.0,なんていうのかな、ちゃんとね
2067.0,2069.0,そういう昔からの繋がりっていうのはね
2069.0,2071.0,ボロ雑巾絞るような感じで
2071.0,2073.0,まだできるんじゃないのかと
2073.0,2075.0,あいつはまだ利用できるんじゃないのかなと
2075.0,2077.0,そういう気持ちでね、頑張っていこうと思ってます
2077.0,2079.0,分かんないんですよ
2079.0,2081.0,連絡一回ね
2081.0,2083.0,携帯に電話が来たんだけど
2083.0,2085.0,携帯に一回電話が来たんだけど
2085.0,2087.0,なんか嫌な予感がして出なかったんですよ
2087.0,2089.0,嫌な予感がして出なくて
2089.0,2091.0,後日かけ直したら出なかったんで
2091.0,2093.0,あいつがね、今生きてるのかどうかっていうのも
2093.0,2095.0,本当に分かんないんですよ
2095.0,2097.0,本当にね、そういうなんかさ
2097.0,2099.0,あれに脅迫感念に駆られてたんだって
2099.0,2101.0,その時俺が休んでる間
2101.0,2103.0,生放送中に俺にかけてきたんじゃないのかなみたいなさ
2103.0,2105.0,よっちゃんとのスカイプもずーっと出なかったからね
2105.0,2107.0,それからのスカイプには一切出なかった
2107.0,2109.0,なるべくスカイプログインしないようにして
2109.0,2111.0,携帯もできるだけ
2111.0,2113.0,携帯もできるだけ電源切っといて
2113.0,2115.0,できるだけ俺連絡取らないようにしてたんだよ
2115.0,2117.0,そういうね、フォトボリが冷めるまで
2117.0,2119.0,結局ね、私自身の
2119.0,2121.0,気持ち一つでね、こうやって始まっちゃったんで
2121.0,2123.0,あーでもやっぱね、そうなんだよね
2123.0,2125.0,こうやっていくら戦わないと
2125.0,2127.0,ものすごい厳しい意見も受けられるんですけど
2127.0,2129.0,まぁちょっとやっぱね、面白いなと
2129.0,2131.0,やっぱ忘れかけるんだよね
2131.0,2133.0,長年というかさ、5ヶ月くらいだったけどさ
2133.0,2135.0,やってるうちにさ、なんつーの
2135.0,2137.0,どんどんどんどん鼻が高くなってってさ
2137.0,2139.0,ねー、なんか面白くねーなーみたいなさ
2139.0,2141.0,感じになるんですけど、やっぱりねー
2141.0,2143.0,この乾いた体に五臓六腑に
2143.0,2145.0,なんつーのこれ、染み渡る感じ
2145.0,2147.0,このコメント一つがさ
2147.0,2149.0,五臓六腑に染み渡る感じ
2149.0,2151.0,懐かしいですね、ほんとね
2151.0,2153.0,ほんとだからちょっとね、頑張って
2153.0,2155.0,大爆笑トークして、まぁちょっとね
2155.0,2157.0,後半にかけて大爆笑トークしていこうかなと
2157.0,2159.0,思います
2159.0,2161.0,これからも鼻毛嘔吐は平常文言か
2161.0,2163.0,こんなんですよ、ほんとね、気分やなんで
2163.0,2165.0,いかんせんね、私ほんとにね、かなりメンタルに
2165.0,2167.0,左右されまして、もうやめようと思ったらやっぱりね
2167.0,2169.0,もう止めらんないんすよ、ほんとに
2169.0,2171.0,なので皆さんも、なんとかね
2171.0,2173.0,えー、また
2173.0,2175.0,あの日が来るまで
2175.0,2177.0,えー、一緒に盛り上げて
2177.0,2179.0,いっていただこうかなと
2179.0,2181.0,思います
2181.0,2183.0,ほんとだよ、だからちょっとさ、そろそろ疲れてきた
2183.0,2185.0,私自身まだ疲れていませんよ、今日どんぐらいの
2185.0,2187.0,今日このわけで終わり、ほんとに
2187.0,2189.0,今日このわけで終わりです、ほんとに
2189.0,2191.0,期待しないわけですよ、もうだからさ
2191.0,2193.0,もういいじゃん、諦めようよ、雑談でいいじゃん
2193.0,2195.0,もう、俺自身もそういうさ
2195.0,2197.0,ガップリをドカンと構えて
2197.0,2199.0,雑談放送していこうかなと
2199.0,2201.0,思ってるんですよ、ほんとに
2201.0,2203.0,なので皆さんもね、たまにありますよ
2203.0,2205.0,富士山の動画
2205.0,2207.0,まだ根に持ってんの?富士山の動画
2207.0,2209.0,上げるつもりでもないのにさ
2209.0,2211.0,みんなにチヤホヤさせてさ、ちょっとアクティブ伸びたからってさ
2211.0,2213.0,えー、ちょっとこれ生
2213.0,2215.0,無修正バージョン上げるぜみたいな感じでさ
2215.0,2217.0,なんて勢い余って言っちゃった
2217.0,2219.0,ウンコちゃんをまだ根に持ってるの?
2219.0,2221.0,そういうのはちょっとさ、男らしくないんで
2221.0,2223.0,そこはなんかさ、皆さんも空気読んで
2223.0,2225.0,あ、上げないんだなと
2225.0,2227.0,上げない、雑談だと寿命短いだろ
2227.0,2229.0,別に寿命とか気にして、もう気にしてらんないでしょ
2229.0,2231.0,だってさ、いろいろさ、なんつーの
2231.0,2233.0,ねえ、そのー
2233.0,2235.0,頑張って放送しようみたいなのは余計たぶん
2235.0,2237.0,疲れちゃうんで、もうほんとにね、やっぱいつも通り
2237.0,2239.0,あんまりね、気合い入れずにね
2239.0,2241.0,雑談していこうかなと、思います
2241.0,2243.0,マリオ3の罰ゲームのカラオケ配信もしろ
2243.0,2245.0,いろいろね、皆さん覚えてます
2245.0,2247.0,でもね、ちゃんとね
2247.0,2249.0,やっぱりね
2249.0,2251.0,皆さん迷惑かけましたから
2251.0,2253.0,あのー
2253.0,2255.0,迷惑かけましたから1個ぐらいはね
2255.0,2257.0,1個でかいのやろうかなと
2257.0,2259.0,やっぱね、溜めといてよかったなと
2259.0,2261.0,まあ企画ってわけじゃないですけど
2261.0,2263.0,1個やろうかなと思ってますんでね
2263.0,2265.0,9月、10月ぐらいにね
2265.0,2267.0,9月、10月ぐらいにね
2267.0,2269.0,ちょっとやろうかなと思ってますんで
2269.0,2271.0,それまでやっぱね、吟味していただければなと
2271.0,2273.0,吟味していただければなと
2273.0,2275.0,ツイッター始めろ
2275.0,2277.0,ツイッターなんてやってるやつ
2277.0,2279.0,いい加減さ
2279.0,2281.0,まだやってるのツイッター
2281.0,2283.0,目覚ましたほうがいい
2283.0,2285.0,今すぐばっかりしたほうがいい
2285.0,2287.0,ツイッターやってるのとかは
2287.0,2289.0,本当にモテない
2289.0,2291.0,ただでさえ君たちブサイクなんだから
2291.0,2293.0,そういう内向き内向きみたいなのは
2293.0,2295.0,絶対やらないほうがいい
2295.0,2297.0,ああいうのなんつーの
2297.0,2299.0,有名な人とかがさ
2299.0,2301.0,私今こういうことしてますよみたいなさ
2301.0,2303.0,ワーワーみたいな感じでさ
2303.0,2305.0,チェアをされる
2305.0,2307.0,私たちグミンがやってもね
2307.0,2309.0,なんにも面白くないんですよ
2309.0,2311.0,どうせさ、なんつーの
2311.0,2313.0,有名生の渋ってさ
2313.0,2315.0,ちょっと可愛い女に
2315.0,2317.0,フレンド申請
2317.0,2319.0,送ってやろうかなみたいなさ
2319.0,2321.0,送ってもどうせ社交事例みたいな感じで
2321.0,2323.0,終わるみたいなさ
2323.0,2325.0,それを信者に挙げ足取られて放送が荒れる
2325.0,2327.0,みたいなさ、そういうの面白くないじゃないですか
2327.0,2329.0,だから本当にね
2329.0,2331.0,やめたほうがいい絶対
2331.0,2333.0,ああ帰ってきたくず
2333.0,2335.0,帰ってきましたごめんなさい
2335.0,2337.0,皆さんもね本当に
2337.0,2339.0,Twitterはやめていただければなと
2339.0,2341.0,思います
2341.0,2343.0,本当にTwitterの仕組み
2343.0,2345.0,俺Twitterとか絶対交わらないよ
2345.0,2347.0,混輪際Twitterとか交わらないんで
2347.0,2349.0,俺Twitterで出会った3人とやったら
2349.0,2351.0,そういうさ、フラチなさ
2351.0,2353.0,フラチな面がいるじゃん絶対
2353.0,2355.0,フラチな面がいるじゃないですか
2355.0,2357.0,あんまり理解してない状態で
2357.0,2359.0,歌い手叩くと痛い目見るぞ
2359.0,2361.0,歌い手叩きと一緒なんですね
2361.0,2363.0,ちゃんと適材適所
2363.0,2365.0,ちゃんと叩く相手を選んでこれから叩くようにします
2365.0,2367.0,あんまり下手にね
2367.0,2369.0,キュライ信者にものすごい
2369.0,2371.0,メールをいただきましたので
2371.0,2373.0,あんまり弱そうな
2373.0,2375.0,大使信者がいなそうな
2375.0,2377.0,歌い手叩いていこうかなと
2377.0,2379.0,思いますので
2379.0,2381.0,皆さんもね
2381.0,2383.0,選んで
2383.0,2385.0,相手は選んで放送して
2385.0,2387.0,放送した方がいいかなと
2387.0,2389.0,思います
2389.0,2391.0,打足叩こう
2391.0,2393.0,俺思うんだけどさ
2393.0,2395.0,真面目な話ね
2395.0,2397.0,真面目な話いいですか?25歳
2397.0,2399.0,真面目な話
2399.0,2401.0,真面目な話のコーナー
2403.0,2405.0,今さ別にまた悪口じゃないんだけどさ
2405.0,2407.0,ニコファーレとかさ
2407.0,2409.0,ねえ
2409.0,2411.0,ニコニコ大会議
2411.0,2413.0,新コーナー
2413.0,2415.0,ほらもう新コーナーできた
2415.0,2417.0,ねえこの新コーナー
2417.0,2419.0,完全にね泣かず飛ばずで
2419.0,2421.0,金輪際出ないであろう新コーナー
2421.0,2423.0,のコーナーやっぱ
2423.0,2425.0,持ってるね早速40分
2425.0,2427.0,開始40分で新コーナーのコーナーができました
2427.0,2429.0,いいから続けようすみません
2429.0,2431.0,ねえなんかさ
2431.0,2433.0,そうやってさ一般向け
2433.0,2435.0,見てる感じしてますけど
2435.0,2437.0,なんかちょっとさ
2437.0,2439.0,やっぱりなんかそういうのってさ
2439.0,2441.0,もう絶対ユニクロ見てるみたい
2441.0,2443.0,だいこん売り始めた
2443.0,2445.0,ユニクロって一時期だいこん
2445.0,2447.0,売り始めてたじゃん
2447.0,2449.0,そういうさ
2449.0,2451.0,ユニクロってね一時期だいこん売ってたじゃん
2451.0,2453.0,いろいろ手伸ばしてやろう
2453.0,2455.0,みたいな
2455.0,2457.0,それでさその時のユニクロ
2457.0,2459.0,見てる見てるほんとにさ
2459.0,2461.0,ユニじゃない
2461.0,2463.0,ユニがんばってんの
2463.0,2465.0,お前
2465.0,2467.0,間に合わないよそろそろ
2467.0,2469.0,いいの?
2469.0,2471.0,爆発してるよ人気余るしが
2471.0,2473.0,今日ユニ
2473.0,2475.0,呼ばなくていいのか?
2475.0,2477.0,俺をサマフェスに
2477.0,2479.0,間に合わないよまかないと
2481.0,2483.0,今年サマフェスあるの?ほんとに
2483.0,2485.0,俺出してよそろそろ
2485.0,2487.0,そろそろ俺出してよ
2487.0,2489.0,サマフェスあるの今年
2489.0,2491.0,やんないの?あそうなんだ
2491.0,2493.0,ちょっとね
2493.0,2495.0,今年やらないみたいな
2495.0,2497.0,来年ね
2497.0,2499.0,頑張ってね来年やろうかなと
2499.0,2501.0,思います
2501.0,2503.0,もうねこれ足掛け3年
2503.0,2505.0,サマフェス出たい
2505.0,2507.0,サマフェス出たいって言ってますけど
2507.0,2509.0,お前来たら荒れるだろ
2509.0,2511.0,俺めっちゃオフィシャル
2511.0,2513.0,だからそういうところでは
2513.0,2515.0,そういうところで俺めっちゃオフィシャルに行くから
2515.0,2517.0,ほんとに
2517.0,2519.0,ユニ関係者の皆さん
2519.0,2521.0,前株ユニの皆さん
2521.0,2523.0,私かなりオフィシャルのトーク
2523.0,2525.0,26歳
2525.0,2527.0,2年勤めて4年
2527.0,2529.0,かなりいいトークできますよ
2529.0,2531.0,なんつーの
2531.0,2533.0,他の奴らがさ
2533.0,2535.0,実況始めたきっかけは何ですか
2535.0,2537.0,いやーやっぱりゲームが好きで
2537.0,2539.0,そういう話しませんよ
2539.0,2541.0,ちゃんと世のため人のためになるような
2541.0,2543.0,放送を心掛けてやっていこうと思って
2543.0,2545.0,どうせサマフェス呼ばれるころで
2545.0,2547.0,26になって
2547.0,2549.0,8月の中旬で26歳になるんで
2549.0,2551.0,8月の中旬で26歳になるんです
2551.0,2553.0,なんで割れしたんですか
2553.0,2555.0,俺が割れしたことになってんの
2555.0,2557.0,俺が割れしたことになってんの
2557.0,2559.0,何そのさ
2559.0,2561.0,風潮被害
2561.0,2563.0,俺そういうやつ大っ嫌いだからマジで
2563.0,2565.0,俺そういうやつマジ大っ嫌いだから
2565.0,2567.0,俺実機ですよ
2567.0,2569.0,俺実機以外は
2569.0,2571.0,許せない立ちなんで
2571.0,2573.0,風評被害で
2573.0,2575.0,ほらだからさそういうさたまに言い間違いあるじゃないですか
2575.0,2577.0,私自身かなり田舎の出身なんで
2577.0,2579.0,田舎の出身なんで言い間違いあるんですよ
2579.0,2581.0,いや割れ中じゃない割れ中じゃないです
2581.0,2583.0,割れ中じゃないです
2583.0,2585.0,ハムハムって知ってる?俺わかんないんだよね
2585.0,2587.0,今流行りのさ
2587.0,2589.0,なんだっけハムハムさん知らないんだよね
2589.0,2591.0,だからちょっと勉強してまたね
2591.0,2593.0,ちゃんとしっかり勉強して
2593.0,2595.0,ハンサム
2595.0,2597.0,ねえなんかやめちゃったんですよ
2597.0,2599.0,ねえ
2599.0,2601.0,せっかくさなんつーの
2601.0,2603.0,なんかねえ
2603.0,2605.0,弟分みたいな感じでさ俺も拍がついてきたな
2605.0,2607.0,みたいな感じでさ
2607.0,2609.0,いよいよ俺も拍がついてきたなみたいな感じでさ
2609.0,2611.0,ガップリを捕まえてさ
2611.0,2613.0,ねえやってやろうかなと
2613.0,2615.0,あいつ女とさ出会って
2615.0,2617.0,女とでしかも俺大好き
2617.0,2619.0,めぐみるくめっちゃかわいいから大好きだったのに
2619.0,2621.0,あのやらさカイヌに手を噛まれた気分です私
2621.0,2623.0,カイヌにまじで手を噛まれた気分
2623.0,2625.0,俺さ唯一ね女の話
2625.0,2627.0,めぐみるくかわいいなみたいな感じでさ
2627.0,2629.0,ちょっと見てたのにさ
2629.0,2631.0,完全にさなんつー恩を仇で返されたよ
2631.0,2633.0,まじで
2633.0,2635.0,カイヌにさ完全に手を噛まれた感じですよ
2635.0,2637.0,なんでねちょっとでも頑張った
2637.0,2639.0,カイヌ好きなんでね
2639.0,2641.0,カイヌ好きなんで
2641.0,2643.0,ちょっと頑張ってやってほしいんですけど色々事情があるみたいなんで
2643.0,2645.0,ちょっとあんまり無理をしないでいただきたい
2645.0,2647.0,若い若男じゃないですか
2647.0,2649.0,私みたいにおっさんじゃないし
2649.0,2651.0,大学1年生とか2年生でしょ
2651.0,2653.0,これから将来がある
2653.0,2655.0,将来がある方じゃないですか
2655.0,2657.0,なので
2657.0,2659.0,あんまりやれよやれよみたいな感じで言えないんですけど
2659.0,2661.0,やっぱりちょっとね
2661.0,2663.0,あんまり
2663.0,2665.0,いや分かんない
2665.0,2667.0,俺分かんない全然
2667.0,2669.0,そういう情報とか知らないから
2669.0,2671.0,情報とか知らないから分かんないけどさ
2671.0,2673.0,ちょっとね寂しいですよね
2673.0,2675.0,唯一さあんまり相手してくれないじゃないですか
2675.0,2677.0,私みたいにコミュ弁系で
2677.0,2679.0,ちびっ子相手で放送してる
2679.0,2681.0,放送ってあんまり大手から相手されないんで
2681.0,2683.0,そういうねなんつーのかな
2683.0,2685.0,ちょっと若い目みたいな感じでちょっと狙っていこうかなみたいな
2685.0,2687.0,そういう気持ちになってた時あったんですよ
2687.0,2689.0,ちょっとこれから若い
2689.0,2691.0,タグ打ちとかハンサム狙っていこうみたいな感じで
2691.0,2693.0,ちょっとそういうなんつーの
2693.0,2695.0,ただもう金輪際そういう考えは一切していまして
2695.0,2697.0,私自身の力一本でやっていこうと
2697.0,2699.0,思ってますよ
2699.0,2701.0,うっくんは自分で思ってる相手にされてないぞ
2701.0,2703.0,本当です
2703.0,2705.0,私自身も最近それにね気づいたんで
2705.0,2707.0,ちゃんとね本当に一から
2707.0,2709.0,本当にねなんつーの
2709.0,2711.0,ちゃんとね
2711.0,2713.0,一から自分を磨いて
2713.0,2715.0,邁進していこうとか
2715.0,2717.0,思ってます本当は
2717.0,2719.0,いや本当ですよ
2719.0,2721.0,もう絶対ね
2721.0,2723.0,すぐね4日ぐらいですぐ鼻が伸びてきちゃいまして
2723.0,2725.0,あっ来たなと
2725.0,2727.0,人気な話来たなと
2727.0,2729.0,飛ぶ鳥落とす勢いだなと
2729.0,2731.0,そうなっちゃうんで
2731.0,2733.0,皆さんのコメント皆さんの
2733.0,2735.0,罵声により私のなんつーのそういう自我を保たれますので
2735.0,2737.0,ちゃんとしっかり調子に乗らないように
2737.0,2739.0,私がちゃんと調子に乗らないように
2739.0,2741.0,実況本について
2741.0,2743.0,ねえ私を悪口言った
2743.0,2745.0,ゆいちくん
2745.0,2747.0,ねえひどいです私頭おかしいって言われちゃいまして
2747.0,2749.0,頭おかしい
2749.0,2751.0,頭おかしいうんこちゃんとみずちは
2751.0,2753.0,みずちは若干それが真実
2753.0,2755.0,正夢になってしまって
2755.0,2757.0,ちょっとねあんまり
2757.0,2759.0,ネタ見もしづらい感じになっちゃうんですけど
2759.0,2761.0,頭おかしい実況者みたいな感じで
2761.0,2763.0,実況者ですらないからね
2763.0,2765.0,実況者ですらないので
2765.0,2767.0,全然コメント見てなかったら立ち見し消します
2767.0,2769.0,ちゃんとね見れないでください
2769.0,2771.0,そういうねその邪悪な成分ってのは
2771.0,2773.0,どんどんどんどん
2773.0,2775.0,不必要なためにどんどん切ってるから
2775.0,2777.0,どんどん切っていきますから
2777.0,2779.0,立ち見しねきれいにしていきますよ
2779.0,2781.0,視聴者選別していきますから
2781.0,2783.0,不必要なために切っていきますよ
2783.0,2785.0,立ち見しから切っていきますよ
2785.0,2787.0,名前に切っちゃダメですよ
2787.0,2789.0,こんなね2ヶ月サボってね
2789.0,2791.0,2ヶ月サボったらほんとにね
2791.0,2793.0,もう叩かれて叱るべきな
2793.0,2795.0,叱るべきな生主ですよ
2795.0,2797.0,そんなやつが立ち見しみゆえ
2797.0,2799.0,立ち見し出ちゃって久々の放送なのに
2799.0,2801.0,俺立ち見し出てる俺すげえみたいな
2801.0,2803.0,そういう放送で立ち見Bも切ります
2803.0,2805.0,1からほんとに立ち見Aとアリーナだけのコメントで
2805.0,2807.0,しっかりねもう
2807.0,2809.0,ざしてここでね
2809.0,2811.0,正座してやろうかなと思ってます
2811.0,2813.0,ちゃんとこの次回もし
2813.0,2815.0,放送があるようであるならば
2815.0,2817.0,私しっかり見ていきますけど
2817.0,2819.0,向こう1週間は
2819.0,2821.0,アリーナだけでいいです
2821.0,2823.0,向こう1週間アリーナに俺宣伝します
2823.0,2825.0,ちゃんとそういうね
2825.0,2827.0,しっかりコメント読めるようになるまでは
2827.0,2829.0,やっぱりね鍛えなきゃいけないと思うんですよ
2829.0,2831.0,こんな申し訳程度の
2831.0,2833.0,なんていうのかな
2833.0,2835.0,皆さんに満足していただけるなんて
2835.0,2837.0,思ってませんので
2837.0,2839.0,しっかりねここでアリーナで叩かれて
2839.0,2841.0,ものすごいねほんとにね
2841.0,2843.0,たまにね10個目で1個ぐらいね
2843.0,2845.0,ものすごいねなんていうのかな
2845.0,2847.0,誹謗中傷があるんですよほんとに
2847.0,2849.0,ものすごい誹謗中傷があるんで
2849.0,2851.0,そういうコメントを心の中に
2851.0,2853.0,刻みましてね
2853.0,2855.0,はいこういう世界なんだなと
2855.0,2857.0,以前より上手く喋れてないよ
2857.0,2859.0,いやでもそうなんだけどさ
2859.0,2861.0,しばらくさやってなかったから
2861.0,2863.0,緊張してるんで1時間ね
2863.0,2865.0,今日やったろうかなと
2865.0,2867.0,だいぶね以前のむんこちゃんに戻ってきてるのかなと
2867.0,2869.0,思ってますので
2869.0,2871.0,ネタ増えたの?いや一切増えてないですよ
2871.0,2873.0,固活してますすでに
2873.0,2875.0,47分でもうすでに空っぽですけど
2875.0,2877.0,それ以上ネタなんてさ
2877.0,2879.0,みんなないじゃん
2879.0,2881.0,俺ネタなんてみんなない中
2881.0,2883.0,やってるわけじゃないですか
2883.0,2885.0,だからそこはそう
2885.0,2887.0,それはやっぱね自分の放送がつまらない理由にしちゃいけませんよ
2887.0,2889.0,ちゃんとネタがないなりに
2889.0,2891.0,頑張ってるんで私自身もね
2891.0,2893.0,ネタがねえんだろお前みたいに叩かれながら
2893.0,2895.0,ちょっと頑張っていこうかなと
2895.0,2897.0,2ヶ月やってたことをちくいち話す
2897.0,2899.0,あーでもそういうのはね
2899.0,2901.0,なかなかやってると本当にねくだらないんで
2901.0,2903.0,じゃあ残り10分で全部話します
2903.0,2905.0,残り10分で全部話すんで
2905.0,2907.0,そこはね皆さん
