start,end,text
1569.44,1571.72,今日タイムシフト残さないから
1571.72,1572.72,今日タイムシフト残さない
1572.72,1574.0,あんまり仕事のことを話した時はね
1574.0,1575.08,タイムシフト残さないと決めてるから
1575.08,1576.56,本当に今日これタイムシフト消すから
1576.56,1577.68,なんとか噛み締めてもいいんだね
1577.68,1580.52,俺のじゃあだからね本当にね
1580.52,1582.44,あれなんだよなそのでも
1582.44,1583.56,どうせ5分ぐらいしか使わないでしょ
1583.56,1584.8799999999999,いや今日1時間待ったら話終わるよ
1584.8799999999999,1586.72,本当に1時間しっかり話す
1586.72,1588.52,最近座ってるだけでも疲れるんだから
1588.52,1589.32,だからあれなんだよね
1589.32,1591.44,そのあれなんだよ
1591.44,1594.04,俺もね最近よくねえなって思ったのが
1594.04,1596.44,疲れた疲れたって絶対言っちゃダメだね
1596.44,1598.4,本当にやっぱりね
1598.4,1599.2,病は来そう
1599.2,1601.04,さっき病は来からの話を言ったんだ
1601.04,1602.8,あのね病は来からって言うじゃん
1602.8,1605.12,マジでだからね疲れた疲れたみたいなさ
1605.12,1606.6,感じで猫背になってってね
1606.6,1608.52,腰痛だしどんどんどんどん
1608.52,1609.8799999999999,本当にネガティブな方向にね
1609.8799999999999,1611.04,進んで行っちゃうわけですよ
1611.04,1612.76,だってねやっぱり元気なやつとか
1612.76,1614.48,仕事できるやつってさ
1614.48,1616.16,なんていうの仕事できるやつってさ
1616.16,1618.12,そういうこと絶対言わないじゃん
1618.1200000000001,1619.72,仕事できるやつって
1619.72,1621.24,そういうこと絶対言わなくない
1621.24,1622.3200000000002,影で言ってるんだけど
1622.3200000000002,1624.5600000000002,ニコ生とかでも言ってるんだろうけどさ
1624.5600000000002,1627.44,そういうのならないとダメだね本当にね
1627.44,1630.1200000000001,断るごとに配信つけりゃ疲れたみたいな
1630.1200000000001,1633.2,弱音を吐くのは別にいいと思うんだけどさ
1633.2,1637.8400000000001,なんかねもうさベクトルが下向きっていうかさ
1637.8400000000001,1639.6000000000001,最近まさにそうなんだよね本当に
1639.6000000000001,1640.3600000000001,なんていうの
1640.3600000000001,1642.44,あの喋る言葉の回数より
1642.44,1644.16,ため息の回数が多いみたいなさ
1644.16,1645.6000000000001,今日もタクシーでもちろん帰ってきたんだけど
1645.6000000000001,1647.48,ずっとね運転手さんに運転手さん
1647.52,1650.08,もう俺本当に再現VTRで言うけど
1650.08,1651.84,運転手さんもう合図地とか
1651.84,1653.04,もう合図地だけでいいです
1653.04,1654.96,俺の話聞いてくださいと
1654.96,1656.64,もうね多分俺帰ったらもうニコ
1656.64,1658.84,もうね何千人かに同じ話をするんだけど
1658.84,1660.56,まずここでなんていうのかな
1660.56,1663.04,俺の話聞いてくれませんかみたいな
1663.04,1665.3600000000001,もうね本当に体がねめっちゃ脇が
1665.3600000000001,1666.3600000000001,もう普段だったらね
1666.3600000000001,1669.6,もう扉叩き折るぐらいの勢いでね
1669.6,1671.3600000000001,もう乗車拒否するぐらいの脇から運転手に
1671.3600000000001,1672.88,もう運転手さんともうね本当にね
1672.88,1673.88,もう帽子を取ってね
1673.88,1676.44,本当に運転手さんと話聞いてくださいと
1676.48,1677.8400000000001,そうネガティブなやつは取捨できない
1677.8400000000001,1679.0800000000002,まさにそうだよね
1679.0800000000002,1680.44,だからちょっとねここ以来でね
1680.44,1682.3600000000001,その生き方変えなきゃいけないなと
1682.3600000000001,1684.8,生き方変えなきゃいけないねと思ってるんだけどね
1684.8,1686.6000000000001,なかなか厳しいわけですよ本当に
1686.6000000000001,1688.48,なかなかねまあ厳しいわけで
1688.48,1691.24,今まで26年間生きてきたさ
1691.24,1693.1200000000001,なんつーの生き方なんてさ
1693.1200000000001,1694.96,なかなか変わんないじゃないですか
1694.96,1696.0,ね頑固になってくるでしょ
1696.0,1698.0,歳とれば
1698.0,1700.8400000000001,歳とればさその歳とるほどさ
1700.8400000000001,1702.52,どんどんどんどんさ
1702.52,1704.2,なんつーの頑固になっていくじゃないですか
1704.2,1705.24,俺ネガティブじゃないよ全然
1705.24,1706.2,全然ネガティブじゃない
1706.24,1707.16,ポジティブだけど
1707.16,1709.8400000000001,あまりにもなんつーの自分のキャパシティを超えると
1709.8400000000001,1710.76,やっぱりどんどんどんどんさ
1710.76,1712.88,そのなんつーの悪い方悪い方に向かっていくじゃないですか
1712.88,1714.76,たぶん1個や2個のミスなんてさ
1714.76,1716.6000000000001,するでしょ動画に書いても
1716.6000000000001,1717.44,するでしょ動画に書いても
1717.44,1719.68,なんで泣きそうなの泣きそうじゃない
1719.68,1720.76,こんな生放送で泣く
1720.76,1722.16,アブさんみたいに泣きますの安心してください
1722.16,1725.88,私生放送で泣くぐらいだったら腹捌くんだ本当に
1725.88,1728.2,五臓六腑を巻き散らしたほうがマジなんだよ本当に
1728.2,1729.2,そんなのだったら自殺します
1729.2,1731.32,生放送で泣くぐらいだったら
1731.32,1732.6000000000001,だからちょっとね
1732.68,1734.0000000000002,買いようと努力を持って
1734.0000000000002,1735.3200000000002,でも最近ちょっとねすごいね
1735.3200000000002,1737.0400000000002,その日常生活に変化が見られてきて
1737.0400000000002,1738.3200000000002,俺タバコはやめたし
1738.3200000000002,1740.2800000000002,もうなんつーのタバコはやめたし
1740.2800000000002,1741.7600000000002,忘飲忘食もしないし
1741.7600000000002,1744.2400000000002,そういうねダラダラした生活みたいなの
1744.2400000000002,1744.8000000000002,一切やめたの
1744.8000000000002,1747.4,部屋も超綺麗になったし
1747.4,1748.8000000000002,だけどねそのなんつーのかな
1748.8000000000002,1751.2800000000002,生き様とか性格みたいなさ
1751.2800000000002,1753.4800000000002,本当に変わんないんですよ本当に
1753.4800000000002,1754.96,なかなかみんなもね
1754.96,1757.72,そのうちね働き始めたら思いますよ本当に
1757.72,1759.4,なんかねなんつーの
1759.4,1766.48,そのねその変えたいけど変えられないみたいなさ
1766.48,1767.3600000000001,タバコはやめたってよっぽど
1767.3600000000001,1769.1200000000001,ほんとでしょじゃあ俺やっぱ
1769.1200000000001,1770.52,室井さんも言ってたけどさ
1770.52,1772.24,室井さんもねよく言ってたけど
1772.24,1773.48,その出世するんだったら
1773.48,1775.6000000000001,出世したいならタバコはやめろみたいなさ
1775.6000000000001,1777.16,そういう昔の発想あるじゃないですか
1777.16,1779.68,やっぱそういうのを大事にしていかなきゃいけないと
1779.68,1781.0800000000002,そういうのを大事にしていかなきゃいけないと
1781.0800000000002,1781.5600000000002,言ってたでしょ
1781.5600000000002,1783.24,踊る大祖先でさ
1783.24,1785.3200000000002,ねそのタバコもやめたみたいな
1785.3200000000002,1785.92,これ言ってたじゃないですか
1785.92,1786.76,だから俺もう分かったじゃん
1786.76,1788.64,室井さんのゆどりょうのタバコはやめようと
1788.64,1790.1200000000001,そういう決心でタバコはやめたわけですよ
1790.1200000000001,1791.5600000000002,本当にもう会社も作るしね
1791.5600000000002,1792.8400000000001,だけどなんかね
1792.8400000000001,1793.6000000000001,そういう心の中に
1793.6000000000001,1794.76,寄り所が必要ですよね
1794.76,1796.2800000000002,本当に寄り所がないと
1796.2800000000002,1799.3200000000002,マジでねやってられない仕事なんで
1799.3200000000002,1800.0,言ってたでしょ
1800.0,1802.0,俺踊る大祖先フェチだもん
1802.0,1804.44,本当に踊る大祖先フェチだからさ
1804.44,1805.92,タバコ吸ってると時間とかなかなか止まらない
1805.92,1807.64,本当にね俺金はさ全然さ
1807.64,1808.72,なんていうのははっきり言ってね
1808.72,1810.5600000000002,あの余ってる余るぐらいあるんだけど
1810.5600000000002,1812.2800000000002,時間がねマジで増える
1812.2800000000002,1814.4,1日が1時間伸びる1日
1814.4,1816.5600000000002,あのタバコ俺ね30本吸ってたんだけど
1816.6,1819.6399999999999,1本にかかる時間が5分と計算したら何分
1819.6399999999999,1821.3999999999999,1本5分吸ってたら150分
1821.3999999999999,1822.48,2時間30分
1822.48,1825.72,2時間30分タバコ以外のことに時間を使えるとなると
1825.72,1826.96,ものすごいなんていうのかな
1826.96,1828.48,その時間が余るわけですよ
1828.48,1830.0,だからこれ本当にね
1830.0,1831.08,あのタバコ吸ってる人はね
1831.08,1831.8799999999999,おすすめマジで
1831.8799999999999,1833.84,あの健康とかさ別にさそんなね
1833.84,1835.2,年取ってさ病気になったらさ
1835.2,1836.6799999999998,若者の税金使ってさ
1836.6799999999998,1838.32,体直せばいいだけだから
1838.32,1839.76,別にね健康のこととか考えなくていいと思う
1839.76,1840.84,しかもぽっくりしねたら楽だし
1840.84,1842.44,ほんと80、90までさなんていうの
1842.44,1844.1599999999999,あのねその管繋がれてさ
1844.2,1846.2,なんていうのポンプみたいなのさ
1846.2,1847.8000000000002,ポンプみたいなのさ
1847.8000000000002,1849.16,ねえなんていうのそのね
1849.16,1850.6000000000001,栄養されてさ
1850.6000000000001,1851.8400000000001,ねえそんなんで行きたくないじゃないですか
1851.8400000000001,1852.88,だからぽっくり行った方がいいと思うんですよ
1852.88,1854.16,人間なんて
1854.16,1855.52,だからねその
1855.52,1856.44,なんていうのタバコなんて
1856.44,1858.0400000000002,健康のためじゃなくて
1858.0400000000002,1859.44,ねえやっぱ若いうちにねやめとくって
1859.44,1860.3600000000001,ほんといいことあると思いますよ
1860.3600000000001,1861.96,人工呼吸器っていうのは
1861.96,1863.3200000000002,タバコの増税とかでやめたんじゃないの
1863.3200000000002,1864.2,いや増税してないでしょ
1864.2,1866.1200000000001,今440でしょまだ
1866.1200000000001,1867.3200000000002,肺がんは一番苦しいよ
1867.3200000000002,1868.5600000000002,何お前ら肺がん
1868.5600000000002,1870.5600000000002,お前肺がん患者の気持ちに
1870.56,1871.6399999999999,なんでお前らが慣れるの
1871.6399999999999,1873.28,肺がんになったこともないのに
1873.28,1876.72,なんで私肺がんの気持ち分かるみたいな
1876.72,1877.36,やめたほうがいいですよ
1877.36,1880.04,私ね水口さんとマリオストリーやってた時に
1880.04,1882.6399999999999,あのがん患者をテーマに投稿したら
1882.6399999999999,1883.96,ものすごい叩かれてたんで
1883.96,1885.3999999999999,なんで皆さんも私をね
1885.3999999999999,1886.96,恐怖にやめていただければなと
1886.96,1888.1599999999999,てかおんこちゃんどこのコメント見てんの
1888.1599999999999,1890.8799999999999,ほんとね今日今までね何分放送してた
1890.8799999999999,1893.08,30分放送してますけど彼これ
1893.08,1894.48,コメントね4つぐらいしか拾ってません
1894.48,1897.04,最近ね視聴者にね指摘されたんですけど
1897.04,1898.72,私雑談放送してる時に
1898.72,1902.44,コメントを拾わなすぎるとさすがに
1902.44,1904.08,一枠につきコメントね
1904.08,1905.44,7個ぐらいしか拾ってないらしいの
1905.44,1906.76,なんかねうんこちゃんマニア
1906.76,1908.32,うんこちゃんマニアから言わせれば
1908.32,1910.68,コメントねあのアンカル雑談の時とかはね
1910.68,1911.2,拾ってみたんだけど
1911.2,1912.4,俺ねあれなんだよね
1912.4,1913.84,俺人の話聞くの大嫌いでさ
1913.84,1914.96,特におめえらみたいなね
1914.96,1916.64,なんつーちびっ子の話聞くの大嫌いだよほんとに
1916.64,1917.8,何言ってんだよお前ら
1917.8,1919.32,何を言ってんだよお前らと
1919.32,1920.6000000000001,いうことでだから皆さん別にね
1920.6000000000001,1922.32,コメントとかしなくていいですほんとに
1922.32,1923.44,そんなにね求めてないんで
1923.44,1924.8,私の話だまーってね
1924.8,1926.08,ブロック米みたいな感じで
1926.08,1927.52,別にブロック米が聞いてても
1927.52,1928.68,皆さんが聞いてても変わんないですよ
1928.68,1930.24,なんでコメントは別にしなくていいですよ
1930.24,1932.3999999999999,なんでちょっとねその多少ね
1932.3999999999999,1934.36,雑談なんだからコメント拾えよみたいなね
1934.36,1936.9199999999998,俺もそういうコメンあのー気持ちを
1936.9199999999998,1938.48,まあ多少わかりますので
1938.48,1941.72,ちょっとね今後拾っていこうかなと
1941.72,1943.3999999999999,お前に読ますためにコメしてねーから
1943.3999999999999,1944.24,なるほどね
1944.24,1945.6,あ逆にねなるほどね
1945.6,1947.76,君たちも一人ごと言ってると
1947.76,1948.8799999999999,なるほど悪くないと思いますよ
1948.8799999999999,1949.72,こういうなんつーのかな
1949.72,1953.0,あのーなんていうっけそういう扉を閉める
1953.0,1956.12,症候群みたいな扉を決める
1956.12,1957.68,症候群みたいないるじゃないですか
1957.68,1960.84,なんかいるじゃんなんかそういう病気
1960.84,1962.28,いるじゃんなんか扉を閉める
1962.28,1964.64,症候群みたいないるでしょ
1964.64,1965.8,なんかいるじゃんなんかさ
1965.8,1967.48,自閉症そう怒られちゃうからね
1967.48,1968.92,あんまりね放送でさ
1968.92,1970.16,自閉症とか言ったら怒られちゃうけど
1970.16,1972.4,なんかねその扉を閉める症候群みたいなさ
1972.4,1973.0,いるじゃないですか
1973.0,1975.28,だからそういうね感じでやっていくのも
1975.28,1976.2,悪くないと思いますよ
1976.2,1978.04,なお君たちみたいなねほんとクズをね
1978.04,1980.32,世の中に放ったらそれこそ大問題がね
1980.32,1981.4,起きちゃうんでできればね
1981.4,1983.3600000000001,この中の檻のこの檻の中にね
1983.3600000000001,1984.72,この留置所の中だけで
1984.72,1987.0,生きがっていただければなと思います
1987.0,1988.64,あんまりね外に出ても相手されないですよ
1988.64,1989.4,君たちはね本当に
1989.4,1991.0400000000002,絶望的に面白くないですよ本当に
1991.0400000000002,1993.48,なんかねメールとかでもよく来るんですけど
1993.48,1994.2800000000002,君たちのコメントはね
1994.2800000000002,1995.0800000000002,まあ私自身も別に
1995.0800000000002,1996.3200000000002,そんな面白い人間じゃないんですけど
1996.3200000000002,1997.8000000000002,まあ面白くないんで
1997.8000000000002,1999.2,できるだけでなんていうのかな
1999.2,2000.8000000000002,そのあんまりね恥ずかしいですよ
2000.8000000000002,2003.8000000000002,本当にポコ太郎コミュとかをね
2003.8000000000002,2005.2800000000002,荒らしてる人もいるみたいですけど
2005.2800000000002,2007.2,あんまりねそういうことしてもね
2007.2,2008.2,だってさ例えばね
2008.2,2009.44,もうすげーわかりやすく言うとさ
2009.44,2010.0800000000002,俺のコンビニのね
2010.0800000000002,2012.44,掲示板とか見てる人がいると思うんだけどさ
2012.44,2015.24,ニコ生四大元これこれみたいなさ
2015.24,2019.3200000000002,あのコメントを見て笑うことってありますか
2019.3200000000002,2021.1200000000001,本当ねだからそういう人のフリして
2021.1200000000001,2022.0,我がフリ直せっていうこと
2022.0,2025.0,ああいうのってさ本当に面白くないじゃん
2025.0,2026.6000000000001,マジでなんかびっくりするな
2026.6000000000001,2028.2,びっくりしない目が点になるでしょ
2028.2,2031.28,本当に100%近くがあれ別にね
2031.28,2032.76,本人がやれって言ってるわけじゃなくて
2032.76,2034.16,なんか面白くない人が
2034.16,2036.92,そういうのやってると思うんですよ
2036.92,2038.88,だから別にその荒らし行為は別に
2038.88,2040.0800000000002,私止めませんけど
2040.0800000000002,2042.3200000000002,やめろって言ってもやる人絶対いるし
2042.3200000000002,2043.0400000000002,でもねなんか別に
2043.0400000000002,2045.44,面白いやり方があるんじゃないのかなと
2045.44,2046.92,思考回路がそうでしょ
2046.92,2048.36,面白くなくない全然あんな
2048.36,2049.96,あんな宣伝されてもさ
2049.96,2051.28,面白いこと一つもないじゃん
2051.28,2052.28,あれって誰がやってるのわかんない
2052.28,2054.2000000000003,なんかねそういう工作員みたいなさ
2054.2000000000003,2056.04,そういうのがいるんですよ多分
2056.04,2057.04,荒らしでしょ
2057.04,2058.1600000000003,そう面白くないじゃんそこは
2058.1600000000003,2060.08,みんなもう万情一致じゃないですか
2060.08,2060.88,ため息しか出ない
2060.88,2062.4,俺ため息も出ない本当に
2062.4,2064.0,ため息まで目が点になる
2064.0,2066.36,これ何か俺絶対あれは削除しない
2066.36,2067.76,あえてねもう晒し上げ
2067.8,2068.76,もうIDも晒し上げる
2068.76,2070.1200000000003,あいつらさ
2070.1200000000003,2071.5600000000004,マジでうめえのが
2071.5600000000004,2073.1600000000003,ID晒し上げてやろうみたいな感じでさ
2073.1600000000003,2073.92,見るとさ
2073.92,2075.7200000000003,もうものすごいけどコミ抜けてんの
2076.8,2078.6000000000004,職人なんだよな
2078.6000000000004,2079.76,残りがだけ残して
2079.76,2080.88,なんか人気ないんですよ
2080.88,2082.76,あのおならの匂いだけ残してさ
2082.76,2084.48,音は聞かせねえみたいな感じでね
2084.48,2086.84,残りが一つ残りがだけ残して
2086.84,2088.2000000000003,スッと消えてくの
2088.2000000000003,2090.44,ID晒し上げられないの
2090.44,2092.4,プロなんだよねスカシッペマジで
2092.4,2093.96,あれはね
2093.96,2095.36,すごいと思う本当に
2095.36,2097.28,最近コミ掲示板のコミ削除してるんだけど
2097.76,2098.92,俺一個も削除したことない
2098.92,2099.92,一個ぐらいあるのかな
2099.92,2100.8,最近はしてないよ
2100.8,2102.6000000000004,多分ブレインが削除してるんだと思う
2102.6000000000004,2104.0800000000004,なんかね
2104.0800000000004,2105.0400000000004,最近ねその
2105.0400000000004,2106.6000000000004,みんなの前に現れないからね
2106.6000000000004,2107.8,その新参の人はね
2107.8,2109.1200000000003,分かってないと思いますけど
2109.1200000000003,2110.2000000000003,私ねその昔ね
2110.2000000000003,2111.48,ブレインさんっていう人がね
2111.48,2113.48,私のコミュニティを管理してまして
2113.48,2115.1200000000003,その人もね権限を持ってるんですよ
2115.1200000000003,2116.2400000000002,だから多分ブレインがね
2116.2400000000002,2119.48,そのどんなコミを削除してるか分かんない
2119.48,2120.8,どんなコミを削除してんの
2120.8,2122.0800000000004,分かんない
2122.0800000000004,2124.0800000000004,俺自身聞いてないから分かんない
2124.0800000000004,2125.36,ビンゴしません
2125.36,2125.88,ビンゴしてね
2125.88,2128.2400000000002,ものすごい黒歴史になったんで
2128.2400000000002,2129.6400000000003,あ!タグチの住所折り返した
2129.6400000000003,2130.44,あんなのだってさ
2130.44,2132.08,面白くもなんともねえって言うかさ
2132.08,2132.6,嫌じゃない?
2132.6,2135.2000000000003,単純に自分の住所書かれてさ
2135.2000000000003,2135.6800000000003,嫌でしょ
2135.6800000000003,2137.04,そんなの別になんつーの
2137.04,2138.04,その値段にならないって言うかさ
2138.04,2139.56,可哀想じゃん普通に考えて
2139.56,2140.56,あれはちょっとねやめたほうがいいよ
2140.56,2141.7200000000003,普通になんかね
2141.7200000000003,2143.84,そのいろいろ倫理的な問題があると思う
2143.84,2144.2000000000003,普通に
2144.2000000000003,2145.44,ちょっと水飲むわ
2145.44,2149.44,あれ折り返した
2149.44,2152.12,ねえいじり良くないかっていうかさ
2152.12,2152.92,まあでもねその
2152.92,2154.2000000000003,自分がこういう放送してるから
2154.2000000000003,2155.52,いけないってのは分かってるんですけど
2155.52,2156.6,まあそういうの湧くんですよ
2156.6,2157.4,だからだからそれは
2157.4,2159.8,俺結構コミュニティの掲示板を絶対見てるよ
2159.8,2162.36,ある程度見てるある程度見てるよ
2162.36,2164.32,その比較的その読むようにはしてる
2164.32,2165.36,だってさいろんなところでさ
2165.36,2166.36,やっぱ悪口とかさね
2166.36,2167.7599999999998,褒められたりするわけじゃない
2167.7599999999998,2169.24,でも全部把握しきれないわけ
2169.24,2170.32,2チャンネルでさ
2170.32,2172.12,なんつーのいろいろ褒められたり
2172.12,2173.28,悪口言われてたりしてもさ
2173.28,2174.0,どこを見ればいいのか
2174.0,2175.7599999999998,よくわかんないから俺
2175.7599999999998,2176.48,だからとりあえず
2176.48,2177.72,だからクレームとかがあったら
2177.72,2179.64,コミュの掲示板に書けって言ってんのにさ
2179.64,2181.32,なんつーのだから言ってるじゃない
2181.36,2182.76,だからいつもコミュの掲示板は
2182.76,2183.4,毎回チェックしてる
2183.4,2185.6000000000004,自分で書いたりはしないけど絶対
2185.6000000000004,2187.7200000000003,だから掲示板気持ち悪い
2187.7200000000003,2189.1600000000003,まあそうだねでもなかなかね
2189.1600000000003,2191.7200000000003,あそうだ今日のMVPのコーナー
2191.7200000000003,2193.92,ちょ今日のMVPのコーナー行くわ
2193.92,2196.6400000000003,なんか面白いコメントあったわ
2196.6400000000003,2197.96,ちょっと待ってね今日のMVPのコーナー
2197.96,2199.8,みんな掲示板を見てくださいね
2199.8,2201.56,結構ね面白い面白いね
2201.56,2204.1600000000003,俺の気に入ったあれがあったわ
2204.1600000000003,2205.0800000000004,ちょっと待ってね
2205.0800000000004,2208.0,どんだけ削除されてんだよこれ
2208.0,2210.4,何書いたのお前ら
2210.4,2212.88,ひどすぎるだろこの削除の
2212.88,2216.28,削除されすぎだろ
2216.28,2217.2400000000002,ちょっと待ってね
2217.2400000000002,2219.32,どこだっけな結構
2219.32,2222.32,待ってねどこだ
2222.32,2224.2000000000003,この前だ
2224.2000000000003,2225.08,ちょっとなんか適当に誰か
2225.08,2229.52,なんかについて話し合ってて
2229.52,2231.2400000000002,あれだよなんだっけ
2231.2400000000002,2234.64,MAXの引退みたいなさ
2234.64,2239.56,その辺その辺の流れ
2239.56,2241.48,ちょっと待ってね5709
2241.48,2245.48,そんな先じゃねえ
2245.48,2247.64,結構ね何気にコメントするんだよ
2247.64,2249.2799999999997,ほんとにこういう子やつら
2249.2799999999997,2250.48,これこれこれ行くよ
2250.48,2254.44,ちょっと待ってね今日のMVPのコーナー
2254.44,2256.04,これやろうとしてた忘れてた
2256.04,2257.16,相場の実況してた人
2257.16,2258.32,まぁそうそうわかんないけど
2258.32,2260.16,俺見たことないから
2260.16,2262.16,なんか親父の借金でとかさ
2262.16,2264.72,ものすげえ絡みにくい理由で引退した
2264.72,2267.36,水口以来のなんかそういう
2267.36,2268.7599999999998,本気でやめなきゃいけない
2268.76,2271.1200000000003,人間みたいなさそんな
2271.1200000000003,2274.88,もう最初からやめてればいいんだよ
2274.88,2281.32,これちょっと待ってね
2281.32,2285.92,このコメント読めてる?みんな
2285.92,2287.6800000000003,コメント読めてる?画質がクソか
2287.6800000000003,2291.1200000000003,じゃあ俺が読むわじゃあ俺が読むね
2291.1200000000003,2294.1200000000003,どんぐらいだ画質クソな俺が読む
2294.1200000000003,2295.88,俺が読むなんかね
2295.88,2298.2000000000003,流れ流れ大体の流れで説明するね
2298.2000000000003,2300.2000000000003,なんかそのうんこちゃんの視聴者って
