start,end,text
0.0,2.0,Wish
2.0,4.0,いやもう今日寝るよ
4.0,6.0,本当に
6.0,8.0,今日も本当早く寝る
12.0,14.0,今日は
14.0,16.0,今日
16.0,18.0,今日
18.0,20.0,今日
20.0,22.0,今日
22.0,24.0,今日
24.0,26.0,今日
26.0,28.0,今日
28.0,30.0,今日
30.0,32.0,今日はもう早く寝る
32.0,34.0,いやばあちゃんが死んでよ
34.0,36.0,信長の野望終わった瞬間に
38.0,40.0,死んじゃいました
40.0,42.0,うちのばあちゃんがついに
42.0,44.0,まあでもこれはもう
44.0,46.0,4ヶ月くらい前からさ飯食ってなかったって
46.0,48.0,言ってたじゃん水だけで生きてたから
48.0,50.0,いずれ来る
50.0,52.0,ほんでさこの前のさ
52.0,54.0,半年前に母ちゃんの葬式やった人が
54.0,56.0,ちょうど来てまたよろしくお願いします
56.0,58.0,なんか俺今さ
58.0,60.0,あの中村西条
60.0,62.0,立山にある中村西条の
62.0,64.0,ご秘技さんになってるから俺言ってやったよ
64.0,66.0,あのうちの親父がもうすぐまたどうせ死ぬだろう
66.0,68.0,からその時はまたよろしくお願いしますって言ってた
70.0,72.0,親父がすげえにが笑いしてた
72.0,74.0,そうだなーつって
74.0,76.0,親父がさもうあれなんだけど
76.0,78.0,加藤家2人になっちゃったんだけどこのままじゃ耐えるよ
78.0,80.0,この優秀なDNAが
82.0,84.0,うちの姉ちゃんもう届いちまったじゃん
84.0,86.0,ほんで
86.0,88.0,俺別に結婚してないし
88.0,90.0,子供もいねえじゃん
90.0,92.0,親父と俺2人になっちまって
92.0,94.0,この葬儀
96.0,98.0,いよいよ思うところがあるね
100.0,102.0,いよいよ
102.0,104.0,であれだよ
104.0,106.0,実家帰ったらフィリピン人の女と喋ったよ
106.0,108.0,親戚中からさ
108.0,110.0,ちょうどそういう時って親戚集まるじゃん
110.0,112.0,そしたらさ
112.0,114.0,その場でもさ
114.0,116.0,すげえ責められてんの
116.0,118.0,お父さんが変なフィリピン人と
118.0,120.0,付き合ってるのなんだろう
120.0,122.0,すげえ責められてて
122.0,124.0,で親父がさ30分くらい
124.0,126.0,そんな人と一緒にいて
126.0,128.0,財産とか取られたらどうすんの
128.0,130.0,みたいな
130.0,132.0,バカ野郎フィリピン人じゃねえよ
132.0,134.0,タイ人だよってみんなに嘘って言ってた
134.0,136.0,俺フィリピンじゃなくてうちのママもしかしたらタイ人になるかもしれない
136.0,138.0,言ってるらしい
138.0,140.0,山形行くんだよタイ人だよ
140.0,142.0,フィリピン人じゃなかった
142.0,144.0,タイ人だった
146.0,148.0,俺に言ってきて
148.0,150.0,お父さん
150.0,152.0,付き合ってる?
152.0,154.0,付き合ってねえことはねえけどよ
154.0,156.0,結婚するの?
156.0,158.0,結婚はしねえって言ってた
158.0,160.0,俺は寂しいんだよ
160.0,162.0,女独身の男だってさ
162.0,164.0,中学校卒業してさ
164.0,166.0,家族のためにずっと働いてきてさ
166.0,168.0,55年間よ子供も育たなきゃいけないしさ
168.0,170.0,一応大黒柱として
170.0,172.0,55年間働いてきたから
172.0,174.0,まあもういいでしょ別に
174.0,176.0,何してても
176.0,178.0,さすがに土地取られちゃったら
178.0,180.0,先祖に怒られちゃうから
180.0,182.0,金は全部フィリピン人とタイ人
182.0,184.0,フィリピン人だかタイ人だか分かんねえけど
184.0,186.0,土地だけは一応残しとけよ
186.0,188.0,お父ちゃん
188.0,190.0,一応俺がついでやるからって
192.0,194.0,言っときました
194.0,196.0,言ったんだよ
196.0,198.0,ばあちゃんが死んじまったから
198.0,200.0,俺と二人家族になっちまったな
200.0,202.0,俺が40までの間に子供作るから
202.0,204.0,それまで元気でいてくれな
204.0,206.0,バカ野郎俺がタイ人と子供作るから
206.0,208.0,お前の弟が先にできるわ
208.0,210.0,って言われた
210.0,212.0,俺もしかしたら34にして
212.0,214.0,弟か妹できるかもしんない
214.0,216.0,そしたらみんなよろしくな
216.0,218.0,可愛がってやってくれな
218.0,220.0,若いからまだ
220.0,222.0,40ぐらいの人だから
222.0,224.0,もしかしたら
224.0,226.0,カピカピになってなかったら
226.0,228.0,俺弟か妹ができるかもしれない
232.0,234.0,ハーフの
234.0,236.0,ハーフの弟が
236.0,238.0,できるかもしれない
238.0,240.0,めっちゃおもろくない
240.0,242.0,俺の弟生まれて
242.0,244.0,弟だったら一緒に実況してもいいだろ
244.0,246.0,自分の子供じゃねえしよ
246.0,248.0,なんだ弟と兄弟で実況
248.0,250.0,ヒカキンとセイキンみたいな感じで
250.0,252.0,タイ人はなんていう名前が多いの
252.0,254.0,タイ人は
256.0,258.0,なんていう名前が多いの
260.0,262.0,兄者と弟者みたいな感じでさ
264.0,266.0,11とアパチャイでやろうぜ
266.0,268.0,俺はだから応援してるの
268.0,270.0,親父面白いから別に
270.0,272.0,俺は子供作ってもいいよ
272.0,274.0,って言ってんの
274.0,276.0,加藤爺爺と加藤アパチャイで2人でやろうよ
276.0,278.0,10年経ったらそいつにつかせればいいだろアパチャイに
278.0,280.0,加藤アパチャイ超かわいいじゃん
280.0,282.0,俺すげえ可愛がるよ
282.0,284.0,なんなら俺が育ててやるよアパチャイ
286.0,288.0,結婚しなくていいじゃん
288.0,290.0,加藤アパチャイ超かわいくない
290.0,292.0,ほんでさ
292.0,294.0,俺もさ子供出すのやだけど
294.0,296.0,おいおいうんこちゃん
296.0,298.0,自分の放送に子供出すんじゃねえよって言われたら
298.0,300.0,バカあるこれ弟のアパチャイだよ
300.0,302.0,まぁ2人で天下取ろうぜ
302.0,304.0,兄者弟者超えようぜ
304.0,306.0,11とアパチャイで
308.0,310.0,タッグ組んだよ
312.0,314.0,最強じゃねえかよ
316.0,318.0,チャンネル名変えるわ
318.0,320.0,順一とアパチャイに
322.0,324.0,先が見えてきたな
324.0,326.0,先が見えてきた
326.0,328.0,女の子だったらわかんない
328.0,330.0,女の子だったらまぁちょっと
330.0,332.0,性感だよね
332.0,334.0,もしかしたらやりたいって言うかもしれないから
334.0,336.0,マジで受けたわ
338.0,340.0,順一のYouTube見てまーす
340.0,342.0,って言ってさ
342.0,344.0,俺の彼女だから喋れって言われて
344.0,346.0,夢やんで飯食ってたらさ
346.0,348.0,すげえそれだよ
348.0,350.0,どうなんだ最近
350.0,352.0,フィリピン人とはどうなの
352.0,354.0,バカ野郎このまま山形連れてってやって
354.0,356.0,温泉行ってきたわ
356.0,358.0,そうなんだ
358.0,360.0,セブ島にも連れてってやったわ
360.0,362.0,おめえは女を
362.0,364.0,旅行とか連れてってやってんのか
364.0,366.0,俺にそんな会商ねえや
366.0,368.0,そういう話してたら
368.0,370.0,いきなり電話がかってきて
370.0,372.0,すげえやだろ
372.0,374.0,親父と親父の彼女の会話聞くの
374.0,376.0,超やじゃん
376.0,378.0,そしたら今は
378.0,380.0,うちの息子が帰ってきてるから
380.0,382.0,おめえ喋れって言われて変わられていきなり
382.0,384.0,あなたのYouTube見てまーす
384.0,386.0,ありがとうございます
386.0,388.0,もしかしたらママになるかもしれないんでね
388.0,390.0,うちのお父さんよろしくお願いします
390.0,392.0,言っといたわ
392.0,394.0,すごいなんでだろう
394.0,396.0,俺も大人になったんだな
396.0,398.0,こんなに素直にママって呼べる人が
398.0,400.0,こんなに早く現れるとは思わなかった
400.0,402.0,俺マジで呼ぶよママって
402.0,404.0,みんなに紹介するよ
406.0,408.0,加藤アパチャイ
408.0,410.0,クソ笑ったわ
410.0,412.0,親戚中からめちゃめちゃ非難されてた
412.0,414.0,めっちゃ怒られてて
414.0,416.0,超かわいそうだったわ
416.0,418.0,別にいいじゃんね
418.0,420.0,残りの人生何年あるかわかんないからさ
420.0,422.0,女ったらしなんだよ
422.0,424.0,うちの親父
430.0,432.0,みんな自由にさ独身でさ
432.0,434.0,死んで半年経ってるんだからさ
434.0,436.0,結婚もできるわけだから
436.0,438.0,自由にさせてやればいいのに
442.0,444.0,ママは日本語ギリギリできる
444.0,446.0,にしてもなんでタイなんだよ
446.0,448.0,聞いたのね
448.0,450.0,日本人の女と遊べばいいじゃん
450.0,452.0,って言ったら
452.0,454.0,バカお前日本の女なんか
454.0,456.0,俺相手にしねえや
456.0,458.0,俺は海外のワールド
458.0,460.0,恋愛に関してはあんなに
460.0,462.0,コテコテの日本語しか
462.0,464.0,日本語というか防臭弁しか喋れないくせに
464.0,466.0,恋愛に関してはワールドワイドなんだよ
466.0,468.0,海外の女が一番いいや
468.0,470.0,親父のそういうね
470.0,472.0,すっとん強なところ俺好きなんですよ
472.0,474.0,すっとん強なところ
474.0,476.0,好きなんですよね
480.0,482.0,すごく僕は
482.0,484.0,親父の恋愛応援してます
490.0,492.0,まあでもうちの
492.0,494.0,ばあちゃんが死んだことに関しては
494.0,496.0,もう3年くらい前から
496.0,498.0,脳梗塞だの心筋梗塞だの
498.0,500.0,心不全だのもう本当に入院
500.0,502.0,ずっとしてたから
502.0,504.0,呼ばれてたわけよ
504.0,506.0,で2月に
506.0,508.0,今年の2月にもういよいよやばいって言われて
508.0,510.0,また家族全員で集まったんだよ親族一同来て
510.0,512.0,でうちやっぱ長男家系の
512.0,514.0,奥さんがうちのあいこちゃんだから
514.0,516.0,あのおばあちゃんだから
516.0,518.0,そこに親戚がバッと集まってくるの
518.0,520.0,親戚多いし
520.0,522.0,でまあもうみんな全員挨拶して
522.0,524.0,もう
526.0,528.0,言い方悪いからけど
528.0,530.0,宴会みたいな感じなんだよもう
530.0,532.0,いやまあばあちゃんよう頑張ったなみたいな
532.0,534.0,泣いてる人もいないし
534.0,536.0,ばあちゃんよう頑張ったなって
536.0,538.0,そういう感じの
538.0,540.0,死との直面だったんだけど
540.0,542.0,あの国別式がね土曜日なのね
542.0,544.0,土曜日までさ
544.0,546.0,うちのばあちゃん腐りそうじゃない
546.0,548.0,すげえショックなんだけど
548.0,550.0,ばあちゃん腐ったら
550.0,552.0,あの今日
552.0,554.0,まあ日付かかって水曜日でしょ
554.0,556.0,ばあちゃん腐んねえかな
556.0,558.0,俺それがすげえ心配なんだよ
558.0,560.0,腐らないよね
566.0,568.0,デロデロになったらすげえショックなんだけど
568.0,570.0,ドライアイス
570.0,572.0,めっちゃ入ってるけど
576.0,578.0,ちょっとあのなんとかして
578.0,580.0,お葬式まできれいな形を
580.0,582.0,保ってあげたいですね
582.0,584.0,きれいな形を
584.0,586.0,保って
586.0,588.0,暑だしさ暑いじゃん
590.0,592.0,ばあちゃんは言わなくていいでしょ
592.0,594.0,ばあちゃんとじいちゃんって
594.0,596.0,死ぬもんでしょ
596.0,598.0,94だよ
598.0,600.0,お前が
600.0,602.0,ばあちゃんが死んだら張ってくれと言ってた
602.0,604.0,なんか俺
604.0,606.0,過去の俺が
606.0,608.0,未来の俺に
608.0,610.0,メッセージをしてるらしいよ
610.0,612.0,見てみようか
612.0,614.0,昨日ちょっと寝てないから
614.0,616.0,この動画を境に寝るぞ
616.0,618.0,11分45秒
622.0,624.0,なんだろうね
624.0,626.0,俺も全く覚えてない
626.0,628.0,ちょっと待ってな
630.0,632.0,最大にして
638.0,640.0,ファイト
640.0,642.0,なんだろう
646.0,648.0,11分45秒
652.0,654.0,これ何年前
654.0,656.0,声が全然違うな
656.0,658.0,9年前の俺
658.0,660.0,25歳の俺か
662.0,664.0,が俺に向けて
664.0,666.0,メッセージを
670.0,672.0,何
682.0,684.0,これ俺か
684.0,686.0,みーちゃんも死んだんだよな
686.0,688.0,9年前の俺だ
690.0,692.0,ばあちゃんの声久々に聞いた
692.0,694.0,ばあちゃん
694.0,696.0,生きてたんかお前
696.0,698.0,ばあちゃん生きてたんだけど
700.0,702.0,ちょっと音でかくしよう
704.0,706.0,ばあちゃん生きてたんだが
712.0,714.0,ちょっと音でかくする
718.0,720.0,ばあちゃんの声
720.0,722.0,久々に聞いたばあちゃんの声
726.0,728.0,みーちゃん
728.0,730.0,ばあばあの声聞かせろ久々に
732.0,734.0,みーちゃん
734.0,736.0,みーちゃん死んじゃったんだよな
740.0,742.0,おいばあの声聞かせろ
742.0,744.0,みーちゃんはどうでもいいからばあの声聞かせろ
744.0,746.0,ばあちゃんの声聞かせろ
748.0,750.0,うちのばあちゃんの
750.0,752.0,最後の
752.0,754.0,最後のセリフ
754.0,756.0,あいつしらっぱくれてる
758.0,760.0,ちなみにあのね
760.0,762.0,うちの実家にね
762.0,764.0,もう一人猫が
764.0,766.0,住み始めまして
766.0,768.0,名前はドロちゃん
768.0,770.0,ドロボー猫のドロちゃん
770.0,772.0,ばあちゃんとみーちゃんとドロちゃんで今
772.0,774.0,ばあちゃんの死体と
774.0,776.0,みーちゃんの偽物のみーちゃん2と
776.0,778.0,ドロちゃんの3人で今
778.0,780.0,レスマンしてるんで
780.0,782.0,ドロボー
782.0,784.0,なんかまた新しい猫いるね
784.0,786.0,おいそいつの名前はドロちゃん
786.0,788.0,ドロボー猫のドロちゃんって
788.0,790.0,ガキ大将みたいなセリフ
790.0,792.0,こいつの名前はドロちゃん
792.0,794.0,ドロボー猫のドロちゃん
794.0,796.0,って言ってたわ
796.0,798.0,みんなよろしくなうちのドロちゃん
800.0,802.0,ってお父さんが言ってたわ
804.0,806.0,誰死体と偽物と
806.0,808.0,ドロボーが今共存してる
808.0,810.0,共存してるっていう
810.0,812.0,ものすごい今カトウケ生態系が
812.0,814.0,尋常じゃないことになってるので
814.0,816.0,みーちゃんマーク2
816.0,818.0,今のみーちゃん死んじゃったんだけど
818.0,820.0,そいつに似た猫がいたつって
820.0,822.0,餌付けしてうちで飼ってるのと
822.0,824.0,その餌付けしてる餌を
824.0,826.0,泥棒しにくるドロちゃん
828.0,830.0,あと94さんのばあちゃんの死体が今家にあります
830.0,832.0,その3人で今構成しております
832.0,834.0,あと俺とお父さん
834.0,836.0,ちょっと複雑な環境になっちゃってるけど
836.0,838.0,これからもひとつ
838.0,840.0,加藤純一をよろしくお願いします
840.0,842.0,俺ちょっともう
842.0,844.0,流石に疲れたわ
844.0,846.0,寝るわ
846.0,848.0,おつ
848.0,850.0,あいこフォーエバー
